Ecommerce Jobs,https://www.naukri.com/ecommerce-jobs?xt=catsrch&qf[]=24.12,Customer Support Executive - ECommerce /Fresher / Exp Salary upto 4LPA,Black and White Business Solutions Pvt Ltd,0-5 Yrs,"2,75,000 - 4,50,000 PA.",Bangalore/Bengaluru
Ecommerce Jobs,https://www.naukri.com/ecommerce-jobs?xt=catsrch&qf[]=24.12,Operations Analyst - eCommerce,Skill Ventory,0-2 Yrs,Not disclosed,Pune
Ecommerce Jobs,https://www.naukri.com/ecommerce-jobs?xt=catsrch&qf[]=24.12,Ecommerce Analyst,DFO Global Performance Commerce Limited,1-2 Yrs,Not disclosed,Bangalore/Bengaluru
Ecommerce Jobs,https://www.naukri.com/ecommerce-jobs?xt=catsrch&qf[]=24.12,Application Developer: eCommerce,IBM India Pvt. Limited,10-14 Yrs,Not disclosed,Bangalore/Bengaluru
Ecommerce Jobs,https://www.naukri.com/ecommerce-jobs?xt=catsrch&qf[]=24.12,eCommerce (Magento) Solution Architect,IBM India Pvt. Limited,9-10 Yrs,Not disclosed,"Noida, Hyderabad/Secunderabad, Bangalore/Bengaluru"
Ecommerce Jobs,https://www.naukri.com/ecommerce-jobs?xt=catsrch&qf[]=24.12,Senior Manager/associate Director - Importer on Record - Ecommerce,Talpro,8-12 Yrs,Not disclosed,"Gurgaon/Gurugram, Gurugram"
Ecommerce Jobs,https://www.naukri.com/ecommerce-jobs?xt=catsrch&qf[]=24.12,Ecommerce Analyst,DFO Global Performance Commerce Limited,1-2 Yrs,Not disclosed,Mumbai
Ecommerce Jobs,https://www.naukri.com/ecommerce-jobs?xt=catsrch&qf[]=24.12,Customer Support - International BPO / ECommerce / Exp salary upto 4L,Black and White Business Solutions Pvt Ltd,0-4 Yrs,"2,00,000 - 4,00,000 PA.",Bangalore/Bengaluru
Ecommerce Jobs,https://www.naukri.com/ecommerce-jobs?xt=catsrch&qf[]=24.12,Day Shift - Telecom / ECommerce / Customer Support / Only Graduates,Black and White Business Solutions Pvt Ltd,0-3 Yrs,"2,00,000 - 3,75,000 PA.",Bangalore/Bengaluru
Ecommerce Jobs,https://www.naukri.com/ecommerce-jobs?xt=catsrch&qf[]=24.12,International BPO - Customer Support / ECommerce / Salary upto 4.2LPA,Black and White Business Solutions Pvt Ltd,0-4 Yrs,"2,00,000 - 4,00,000 PA.",Bangalore/Bengaluru
Ecommerce Jobs,https://www.naukri.com/ecommerce-jobs?xt=catsrch&qf[]=24.12,Immediate Joining ! US Banking / ECommerce / Exp Salary upto 4.2LPA,Black and White Business Solutions Pvt Ltd,0-5 Yrs,"2,00,000 - 4,25,000 PA.",Bangalore/Bengaluru
Ecommerce Jobs,https://www.naukri.com/ecommerce-jobs?xt=catsrch&qf[]=24.12,Hiring For US Banking / ECommerce / Exp Salary upto 4.2LPA,Black and White Business Solutions Pvt Ltd,0-5 Yrs,"2,75,000 - 4,50,000 PA.",Bangalore/Bengaluru
Ecommerce Jobs,https://www.naukri.com/ecommerce-jobs?xt=catsrch&qf[]=24.12,Sr. Customer Support - International Voice / Banking / ECommerce / 4L,Black and White Business Solutions Pvt Ltd,0-5 Yrs,"2,75,000 - 4,50,000 PA.",Bangalore/Bengaluru
Ecommerce Jobs,https://www.naukri.com/ecommerce-jobs?xt=catsrch&qf[]=24.12,US Banking - ECommerce / Customer Support / Exp Salary upto 4.2LPA,Black and White Business Solutions Pvt Ltd,0-5 Yrs,"2,75,000 - 4,50,000 PA.",Bangalore/Bengaluru
Ecommerce Jobs,https://www.naukri.com/ecommerce-jobs?xt=catsrch&qf[]=24.12,Hiring Freshers For Voice and Non-Voice / Customer Support / ECommerce,Black and White Business Solutions Pvt Ltd,0-5 Yrs,"2,00,000 - 3,75,000 PA.",Bangalore/Bengaluru
Ecommerce Jobs,https://www.naukri.com/ecommerce-jobs?xt=catsrch&qf[]=24.12,Day Shift - Hiring For Domestic BPO / Telecom / ECommerce / Sal 18k,Black and White Business Solutions Pvt Ltd,0-3 Yrs,"2,00,000 - 3,75,000 PA.",Bangalore/Bengaluru
Ecommerce Jobs,https://www.naukri.com/ecommerce-jobs?xt=catsrch&qf[]=24.12,Ecommerce Specialist,TALENT MAX HR & MANAGEMENT CONSULTANTS,2-6 Yrs,Not disclosed,Indore
Ecommerce Jobs,https://www.naukri.com/ecommerce-jobs?xt=catsrch&qf[]=24.12,Manager - Online Marketing - eCommerce,Catalyst,3-6 Yrs,Not disclosed,Bangalore/Bengaluru
Ecommerce Jobs,https://www.naukri.com/ecommerce-jobs?xt=catsrch&qf[]=24.12,Mobile Product Manager - Travel eCommerce,Pinnacle Solutions,11-14 Yrs,Not disclosed,Bangalore/Bengaluru
ERP Jobs,https://www.naukri.com/erp-jobs?xt=catsrch&qf[]=24.04,ERP Functional Consultant,ITC Infotech India Ltd,5-10 Yrs,Not disclosed,Bangalore/Bengaluru
ERP Jobs,https://www.naukri.com/erp-jobs?xt=catsrch&qf[]=24.04,ERP Functional Consultant,ITC Infotech India Ltd,3-7 Yrs,Not disclosed,Bangalore/Bengaluru
ERP Jobs,https://www.naukri.com/erp-jobs?xt=catsrch&qf[]=24.04,Consultant - CPQ/ERP,Apex IT,2-7 Yrs,Not disclosed,Bangalore/Bengaluru
ERP Jobs,https://www.naukri.com/erp-jobs?xt=catsrch&qf[]=24.04,Consultant - CPQ/ERP,Apex IT,2-7 Yrs,Not disclosed,Bangalore/Bengaluru
ERP Jobs,https://www.naukri.com/erp-jobs?xt=catsrch&qf[]=24.04,Principal ERP Functional Consultant-NetSuite(Nightshift),Oracle India Pvt. Ltd.,8-13 Yrs,Not disclosed,Hyderabad/Secunderabad
ERP Jobs,https://www.naukri.com/erp-jobs?xt=catsrch&qf[]=24.04,ERP L1 Oracle Functional consultant,Version 1,6-11 Yrs,Not disclosed,Bangalore/Bengaluru
ERP Jobs,https://www.naukri.com/erp-jobs?xt=catsrch&qf[]=24.04,Package Consultant Oracle ERP Cloud Financials,IBM India Pvt. Limited,6-10 Yrs,Not disclosed,Bangalore/Bengaluru
ERP Jobs,https://www.naukri.com/erp-jobs?xt=catsrch&qf[]=24.04,Package Consultant: Oracle ERP Cloud Financials,IBM India Pvt. Limited,12-14 Yrs,Not disclosed,Bangalore/Bengaluru
ERP Jobs,https://www.naukri.com/erp-jobs?xt=catsrch&qf[]=24.04,"Package Consultant: Oracle ERP Cloud Financials (AR, AP & GL)",IBM India Pvt. Limited,12-14 Yrs,Not disclosed,Bangalore/Bengaluru
ERP Jobs,https://www.naukri.com/erp-jobs?xt=catsrch&qf[]=24.04,ERP Functional Consultant,ITC Infotech India Ltd,2-3 Yrs,Not disclosed,Kolkata
ERP Jobs,https://www.naukri.com/erp-jobs?xt=catsrch&qf[]=24.04,Solution Consultant - ERP Software Projects,Trapeze Software,10-14 Yrs,Not disclosed,Mumbai
ERP Jobs,https://www.naukri.com/erp-jobs?xt=catsrch&qf[]=24.04,Solution Consultant - ERP,Trapeze Software,6-11 Yrs,Not disclosed,Mumbai
ERP Jobs,https://www.naukri.com/erp-jobs?xt=catsrch&qf[]=24.04,Oracle ERP Fusion Finance Functional Consultant,Peloton Consulting India Private Limited,1-6 Yrs,Not disclosed,"Hyderabad/Secunderabad, telangana"
ERP Jobs,https://www.naukri.com/erp-jobs?xt=catsrch&qf[]=24.04,Oracle ERP Fusion Finance Functional Consultant,Peloton,1-6 Yrs,Not disclosed,"Hyderabad/Secunderabad, telangana"
ERP Jobs,https://www.naukri.com/erp-jobs?xt=catsrch&qf[]=24.04,Oracle ERP Fusion SCM Functional Consultant,Peloton Consulting India Private Limited,1-5 Yrs,Not disclosed,"Hyderabad/Secunderabad, telangana"
ERP Jobs,https://www.naukri.com/erp-jobs?xt=catsrch&qf[]=24.04,Oracle ERP Fusion SCM Functional Consultant,Peloton,2-5 Yrs,Not disclosed,"Hyderabad/Secunderabad, telangana"
ERP Jobs,https://www.naukri.com/erp-jobs?xt=catsrch&qf[]=24.04,ERP Consultant (MSD 365),Tanla Solutions Limited,5-8 Yrs,Not disclosed,Hyderabad/Secunderabad
ERP Jobs,https://www.naukri.com/erp-jobs?xt=catsrch&qf[]=24.04,ERP / CRM Consultant Microsoft Dynamics,Tanla Solutions Ltd,4-9 Yrs,Not disclosed,"Hyderabad/Secunderabad, indas"
ERP Jobs,https://www.naukri.com/erp-jobs?xt=catsrch&qf[]=24.04,Senior ERP Consultant(Night Shift),Oracle India Pvt. Ltd.,3-8 Yrs,Not disclosed,Hyderabad/Secunderabad
VLSI Jobs,https://www.naukri.com/vlsi-jobs?xt=catsrch&qf[]=24.05,VLSI Design Engineer,Datapoint Info Solutions,0-1 Yrs,Not disclosed,Hyderabad/Secunderabad
VLSI Jobs,https://www.naukri.com/vlsi-jobs?xt=catsrch&qf[]=24.05,VLSI Design Engineer ( Aggregate Min 70% Bangalore Candidates only ),Jobjunctioninfo Pvt. Ltd.,0-0 Yrs,Not disclosed,Bangalore/Bengaluru
VLSI Jobs,https://www.naukri.com/vlsi-jobs?xt=catsrch&qf[]=24.05,VLSI Design Engineer ( Bangalore Candidates only ),Jobjunctioninfo Pvt. Ltd.,0-0 Yrs,Not disclosed,Bangalore/Bengaluru
VLSI Jobs,https://www.naukri.com/vlsi-jobs?xt=catsrch&qf[]=24.05,VLSI Opening-Design Verification Engineer,Ignitarium Technology Solutions Private Limited,2-7 Yrs,"50,000 - 3,00,000 PA.","Kochi/Cochin, Bangalore/Bengaluru"
VLSI Jobs,https://www.naukri.com/vlsi-jobs?xt=catsrch&qf[]=24.05,PHYSICAL DESIGN ENGINEER ( VLSI DOMAIN),Techskills,3-8 Yrs,Not disclosed,Bangalore/Bengaluru
VLSI Jobs,https://www.naukri.com/vlsi-jobs?xt=catsrch&qf[]=24.05,Asic /SOC Verification Engineer / VLSI Designer,VTalentGlobal,5-10 Yrs,Not disclosed,"Noida, Hyderabad/Secunderabad, Bangalore/Bengaluru"
VLSI Jobs,https://www.naukri.com/vlsi-jobs?xt=catsrch&qf[]=24.05,VLSI Openings- Design Engineer,Ignitarium Technology Solutions Private Limited,7-8 Yrs,Not disclosed,"Kochi/Cochin, Bangalore/Bengaluru"
VLSI Jobs,https://www.naukri.com/vlsi-jobs?xt=catsrch&qf[]=24.05,VLSI ASIC Design Engineers,Innovium,5-10 Yrs,Not disclosed,Bangalore/Bengaluru
VLSI Jobs,https://www.naukri.com/vlsi-jobs?xt=catsrch&qf[]=24.05,VLSI-CAD-Design-Engineer,"Advanced Micro Devices, Inc",2-6 Yrs,Not disclosed,Hyderabad/Secunderabad
VLSI Jobs,https://www.naukri.com/vlsi-jobs?xt=catsrch&qf[]=24.05,VLSI Design Engineer,TekBrains Pvt. Ltd,1-6 Yrs,Not disclosed,Patna
VLSI Jobs,https://www.naukri.com/vlsi-jobs?xt=catsrch&qf[]=24.05,VLSI Design Engineer,TekBrains Pvt. Ltd,1-6 Yrs,Not disclosed,Patna
VLSI Jobs,https://www.naukri.com/vlsi-jobs?xt=catsrch&qf[]=24.05,VLSI Design Engineer,Macart Equipment Pvt.Ltd.,2-5 Yrs,Not disclosed,Pune
VLSI Jobs,https://www.naukri.com/vlsi-jobs?xt=catsrch&qf[]=24.05,VLSI Opening- Analog Mixed Signal Verification Engineer,Ignitarium Technology Solutions Private Limited,3-8 Yrs,Not disclosed,"Kochi/Cochin, Bangalore/Bengaluru"
VLSI Jobs,https://www.naukri.com/vlsi-jobs?xt=catsrch&qf[]=24.05,Skandysys is Hiring VLSI Verification Engineers,Skandysys Private Limited,3-8 Yrs,"12,00,000 - 22,00,000 PA.","Hyderabad/Secunderabad, Bangalore/Bengaluru"
VLSI Jobs,https://www.naukri.com/vlsi-jobs?xt=catsrch&qf[]=24.05,VLSI ASIC Verification Engineer,Innovium,5-10 Yrs,Not disclosed,Bangalore/Bengaluru
VLSI Jobs,https://www.naukri.com/vlsi-jobs?xt=catsrch&qf[]=24.05,IP VERIFICATION ENGINEER (VLSI DOMAIN),Techskills,10-15 Yrs,Not disclosed,Bangalore/Bengaluru
VLSI Jobs,https://www.naukri.com/vlsi-jobs?xt=catsrch&qf[]=24.05,VLSI Silicon Validation / Emulation Engineer,Innovium,5-10 Yrs,Not disclosed,Bangalore/Bengaluru
VLSI Jobs,https://www.naukri.com/vlsi-jobs?xt=catsrch&qf[]=24.05,DFT ENGINEER (VLSI DOMAIN),Techskills,3-8 Yrs,Not disclosed,Bangalore/Bengaluru
VLSI Jobs,https://www.naukri.com/vlsi-jobs?xt=catsrch&qf[]=24.05,MEMORY LAYOUT ENGINEER (VLSI DOMAIN),Techskills,5-10 Yrs,Not disclosed,Bangalore/Bengaluru
Mainframe Jobs,https://www.naukri.com/mainframe-jobs?xt=catsrch&qf[]=24.13,HCL Hiring Mainframe Developer - Bangalore/Chennai - 27th mar'21,HCL Technologies Ltd,1-3 Yrs,"1,00,000 - 4,00,000 PA.","Chennai, Bangalore/Bengaluru"
Mainframe Jobs,https://www.naukri.com/mainframe-jobs?xt=catsrch&qf[]=24.13,Mainframe Developer,Ingram Micro,4-9 Yrs,Not disclosed,"Mumbai, Chennai"
Mainframe Jobs,https://www.naukri.com/mainframe-jobs?xt=catsrch&qf[]=24.13,Mainframe Developer,Capgemini Technology Services India Limited,4-6 Yrs,Not disclosed,Pune
Mainframe Jobs,https://www.naukri.com/mainframe-jobs?xt=catsrch&qf[]=24.13,Mainframe Developer @ CGI,Cgi Group,4-8 Yrs,"50,000 - 1,25,000 PA.","Hyderabad/Secunderabad, Chennai, Bangalore/Bengaluru"
Mainframe Jobs,https://www.naukri.com/mainframe-jobs?xt=catsrch&qf[]=24.13,Mainframe Developer @ CGI,Cgi Group,4-8 Yrs,"50,000 - 1,25,000 PA.","Hyderabad/Secunderabad, Chennai, Bangalore/Bengaluru"
Mainframe Jobs,https://www.naukri.com/mainframe-jobs?xt=catsrch&qf[]=24.13,Mainframe Developer,IBM India Pvt. Limited,3-8 Yrs,Not disclosed,Bangalore/Bengaluru
Mainframe Jobs,https://www.naukri.com/mainframe-jobs?xt=catsrch&qf[]=24.13,Mainframe Developer,IBM India Pvt. Limited,3-5 Yrs,Not disclosed,Bangalore/Bengaluru
Mainframe Jobs,https://www.naukri.com/mainframe-jobs?xt=catsrch&qf[]=24.13,Hiring For Mainframe PL1 Developer - Bangalore,ITC Infotech India Ltd,4-9 Yrs,Not disclosed,Bangalore/Bengaluru
Mainframe Jobs,https://www.naukri.com/mainframe-jobs?xt=catsrch&qf[]=24.13,Mainframe Developer - COBOL/JCL,Pronto Consulting Services,2-7 Yrs,Not disclosed,Anywhere in India
Mainframe Jobs,https://www.naukri.com/mainframe-jobs?xt=catsrch&qf[]=24.13,Mainframe Developer,Megma Services,5-7 Yrs,Not disclosed,Anywhere in India
Mainframe Jobs,https://www.naukri.com/mainframe-jobs?xt=catsrch&qf[]=24.13,Job Opportunity For Mainframe Developer - Chennai,Cibersites India Private Limited,4-9 Yrs,Not disclosed,Chennai
Mainframe Jobs,https://www.naukri.com/mainframe-jobs?xt=catsrch&qf[]=24.13,Mainframe Developer,ENCORA INNOVATION LABS INDIA PRIVATE LIMITED,5-8 Yrs,Not disclosed,Chennai
Mainframe Jobs,https://www.naukri.com/mainframe-jobs?xt=catsrch&qf[]=24.13,Mainframe Developer - Adabas/COBOL,Skill EnableHr,2-6 Yrs,Not disclosed,Chennai
Mainframe Jobs,https://www.naukri.com/mainframe-jobs?xt=catsrch&qf[]=24.13,Mainframe Developer - COBOL/CICS/JCL,Skill EnableHr,1-5 Yrs,Not disclosed,Chennai
Mainframe Jobs,https://www.naukri.com/mainframe-jobs?xt=catsrch&qf[]=24.13,Mainframe - Batch Operations/Production Support,Fiserv,2-6 Yrs,Not disclosed,Chennai
Mainframe Jobs,https://www.naukri.com/mainframe-jobs?xt=catsrch&qf[]=24.13,Maveric Systems - Mainframe Developers (contract To Hire),Maveric Systems Limited,4-7 Yrs,"4,00,000 - 9,00,000 PA.",Pune
Mainframe Jobs,https://www.naukri.com/mainframe-jobs?xt=catsrch&qf[]=24.13,Mainframe Solution Architect,DXC Technology India Private Limited,10-16 Yrs,Not disclosed,"Noida, Hyderabad/Secunderabad, Pune, Chennai, Bangalore/Bengaluru"
Mainframe Jobs,https://www.naukri.com/mainframe-jobs?xt=catsrch&qf[]=24.13,YASH Technologies// Currently hiring// Mainframe Developer// Pune,Yash Technologies Pvt ltd,3-5 Yrs,Not disclosed,Pune
Mainframe Jobs,https://www.naukri.com/mainframe-jobs?xt=catsrch&qf[]=24.13,HCL SOFTWARE_Product Divison Hiring For Mainframe Developer_Bangalore,HCL Technologies Limited,7-12 Yrs,Not disclosed,Bangalore/Bengaluru
Middleware Jobs,https://www.naukri.com/middleware-jobs?xt=catsrch&qf[]=24.15,Middleware Administrator,CONDUENT BUSINESS SERVICES INDIA LLP,7-11 Yrs,"11,00,000 - 16,00,000 PA.",Bangalore/Bengaluru
Middleware Jobs,https://www.naukri.com/middleware-jobs?xt=catsrch&qf[]=24.15,Middleware Administrator,IBM India Pvt. Limited,7-9 Yrs,Not disclosed,Hyderabad/Secunderabad
Middleware Jobs,https://www.naukri.com/middleware-jobs?xt=catsrch&qf[]=24.15,Middleware Admin,IBM India Pvt. Limited,5-7 Yrs,Not disclosed,India
Middleware Jobs,https://www.naukri.com/middleware-jobs?xt=catsrch&qf[]=24.15,Middleware Administrator - Chennai (1 - 3 years),Virtusa Consulting Services Pvt Ltd,1-3 Yrs,Not disclosed,Chennai
Middleware Jobs,https://www.naukri.com/middleware-jobs?xt=catsrch&qf[]=24.15,Oracle Fusion Middleware Administration Application Developer,Accenture Solutions Pvt Ltd,4-6 Yrs,Not disclosed,Bangalore/Bengaluru
Middleware Jobs,https://www.naukri.com/middleware-jobs?xt=catsrch&qf[]=24.15,Oracle Fusion Middleware Administration Application Developer,Accenture Solutions Pvt Ltd,6-8 Yrs,Not disclosed,Bangalore/Bengaluru
Middleware Jobs,https://www.naukri.com/middleware-jobs?xt=catsrch&qf[]=24.15,Oracle Fusion Middleware Administration Application Developer,Accenture Solutions Pvt Ltd,4-6 Yrs,Not disclosed,Bangalore/Bengaluru
Middleware Jobs,https://www.naukri.com/middleware-jobs?xt=catsrch&qf[]=24.15,Oracle Fusion Middleware WebLogic Server Admin Application Developer,Accenture Solutions Pvt Ltd,4-6 Yrs,Not disclosed,Bangalore/Bengaluru
Middleware Jobs,https://www.naukri.com/middleware-jobs?xt=catsrch&qf[]=24.15,Middleware Administrator,Sellcraft Global Solutions Private Limited,5-8 Yrs,Not disclosed,"Pune, Chennai, Bangalore/Bengaluru, Delhi / NCR, Mumbai (All Areas)"
Middleware Jobs,https://www.naukri.com/middleware-jobs?xt=catsrch&qf[]=24.15,Middleware Administrator,Sellcraft Global Solutions Private Limited,5-8 Yrs,Not disclosed,"Pune, Chennai, Bangalore/Bengaluru, Delhi / NCR, Mumbai (All Areas)"
Middleware Jobs,https://www.naukri.com/middleware-jobs?xt=catsrch&qf[]=24.15,Middleware Administrator,Zycus Infotech Pvt Ltd,4-9 Yrs,Not disclosed,Mumbai
Middleware Jobs,https://www.naukri.com/middleware-jobs?xt=catsrch&qf[]=24.15,Oracle Fusion Middleware Administration Application Developer,Accenture Solutions Pvt Ltd,4-6 Yrs,Not disclosed,Pune
Middleware Jobs,https://www.naukri.com/middleware-jobs?xt=catsrch&qf[]=24.15,Oracle Fusion Middleware WebLogic Server Admin Application Developer,Accenture Solutions Pvt Ltd,4-6 Yrs,Not disclosed,Pune
Middleware Jobs,https://www.naukri.com/middleware-jobs?xt=catsrch&qf[]=24.15,Middleware Administrator / Engineer,Solugenix India Private Limited,6-11 Yrs,Not disclosed,Hyderabad/Secunderabad(Begumpet)
Middleware Jobs,https://www.naukri.com/middleware-jobs?xt=catsrch&qf[]=24.15,Devops Engineer - Middleware,Fiserv,7-11 Yrs,Not disclosed,Chennai
Middleware Jobs,https://www.naukri.com/middleware-jobs?xt=catsrch&qf[]=24.15,Middleware Administrator,Axiom Technologies,5-8 Yrs,Not disclosed,Bangalore/Bengaluru
Middleware Jobs,https://www.naukri.com/middleware-jobs?xt=catsrch&qf[]=24.15,Middleware Adminstarator,Capgemini Technology Services India Limited,4-6 Yrs,Not disclosed,Bangalore/Bengaluru
Middleware Jobs,https://www.naukri.com/middleware-jobs?xt=catsrch&qf[]=24.15,Opening For Middleware administrator- Mumbai,Clover Infotech Pvt Ltd,4-9 Yrs,Not disclosed,Mumbai (All Areas)
Middleware Jobs,https://www.naukri.com/middleware-jobs?xt=catsrch&qf[]=24.15,"Hiring For Senior Middleware Administrator- Belapur, Navi Mumbai",CMS Info Systems Limited,3-5 Yrs,"5,00,000 - 6,00,000 PA.",Navi Mumbai
Mobile Jobs,https://www.naukri.com/mobile-jobs?xt=catsrch&qf[]=24.14,Application Developer - Mobile Android,IBM India Pvt. Limited,3-8 Yrs,Not disclosed,Bangalore/Bengaluru
Mobile Jobs,https://www.naukri.com/mobile-jobs?xt=catsrch&qf[]=24.14,Application Developer: Mobile Android,IBM India Pvt. Limited,3-8 Yrs,Not disclosed,Hyderabad/Secunderabad
Mobile Jobs,https://www.naukri.com/mobile-jobs?xt=catsrch&qf[]=24.14,Android Developer - Mobile App Designing,Mongia Green Foundation,0-4 Yrs,Not disclosed,Kolkata
Mobile Jobs,https://www.naukri.com/mobile-jobs?xt=catsrch&qf[]=24.14,Application Developer: SAP NextGen UX & Mobile,IBM India Pvt. Limited,6-8 Yrs,Not disclosed,"Bangalore/Bengaluru, Bangalore"
Mobile Jobs,https://www.naukri.com/mobile-jobs?xt=catsrch&qf[]=24.14,Application Developer: SAP NextGen UX & Mobile,IBM India Pvt. Limited,6-8 Yrs,Not disclosed,Bangalore/Bengaluru
Mobile Jobs,https://www.naukri.com/mobile-jobs?xt=catsrch&qf[]=24.14,Application Developer SAP NextGen UX & Mobile,IBM India Pvt. Limited,6-10 Yrs,Not disclosed,Bangalore/Bengaluru
Mobile Jobs,https://www.naukri.com/mobile-jobs?xt=catsrch&qf[]=24.14,Mobile Application Developer - (IOS & Android),Ingram Micro,4-9 Yrs,Not disclosed,Mumbai
Mobile Jobs,https://www.naukri.com/mobile-jobs?xt=catsrch&qf[]=24.14,Mobile Application Developer - iOS & Android Platform,Bcube Solutions,2-5 Yrs,Not disclosed,Surat
Mobile Jobs,https://www.naukri.com/mobile-jobs?xt=catsrch&qf[]=24.14,Android/IOS Mobile Application Developer (Contract),Lennox India Technology Centre Private Limited,4-8 Yrs,Not disclosed,Chennai
Mobile Jobs,https://www.naukri.com/mobile-jobs?xt=catsrch&qf[]=24.14,Application Developer: Mobile iOS,IBM India Pvt. Limited,3-5 Yrs,Not disclosed,Hyderabad/Secunderabad
Mobile Jobs,https://www.naukri.com/mobile-jobs?xt=catsrch&qf[]=24.14,Android Mobile Application Developer with Kotlin,Codingmart Technologies Private Limited,3-5 Yrs,Not disclosed,"Coimbatore, Bangalore/Bengaluru"
Mobile Jobs,https://www.naukri.com/mobile-jobs?xt=catsrch&qf[]=24.14,Mobile Application Developer,Super India Tech Mark,0-1 Yrs,"1,50,000 - 2,25,000 PA.",Mysore/Mysuru
Mobile Jobs,https://www.naukri.com/mobile-jobs?xt=catsrch&qf[]=24.14,Mobile Application Developer,Super India Tech Mark,0-1 Yrs,"2,00,000 - more than 3,00,000 PA.",Asansol
Mobile Jobs,https://www.naukri.com/mobile-jobs?xt=catsrch&qf[]=24.14,Mobile Application Developer,Super India Tech Mark,0-1 Yrs,"2,25,000 - 4,00,000 PA.",New Delhi
Mobile Jobs,https://www.naukri.com/mobile-jobs?xt=catsrch&qf[]=24.14,Mobile Application Developer,Super India Tech Mark,0-2 Yrs,"1,50,000 - 2,50,000 PA.",Kakinada
Mobile Jobs,https://www.naukri.com/mobile-jobs?xt=catsrch&qf[]=24.14,Mobile Application Developer,Fusion Engineering,0-2 Yrs,"4,50,000 - 5,50,000 PA.",Pune
Mobile Jobs,https://www.naukri.com/mobile-jobs?xt=catsrch&qf[]=24.14,Mobile Application Developer,Super India Tech Mark,0-1 Yrs,"3,00,000 - 3,75,000 PA.",Maldah/Malda
Mobile Jobs,https://www.naukri.com/mobile-jobs?xt=catsrch&qf[]=24.14,Mobile Application Developer,Super India Tech Mark,0-2 Yrs,"1,50,000 - 2,50,000 PA.",Mysore/Mysuru
Mobile Jobs,https://www.naukri.com/mobile-jobs?xt=catsrch&qf[]=24.14,Android Developer - Mobile App Designing,Mads Technologies Pvt. Ltd,0-2 Yrs,Not disclosed,Noida
Network administrator Jobs,https://www.naukri.com/network-administrator-jobs?xt=catsrch&qf[]=24.06,Network Administrator,Super India Tech Mark,0-2 Yrs,"1,25,000 - 2,25,000 PA.",Hyderabad/Secunderabad(Ghatkesar)
Network administrator Jobs,https://www.naukri.com/network-administrator-jobs?xt=catsrch&qf[]=24.06,Network Administrator,IBM India Pvt. Limited,8-12 Yrs,Not disclosed,Bangalore/Bengaluru
Network administrator Jobs,https://www.naukri.com/network-administrator-jobs?xt=catsrch&qf[]=24.06,Network Administrator,Super India Tech Mark,0-2 Yrs,"1,25,000 - 2,25,000 PA.",Tirunelveli/Nellai
Network administrator Jobs,https://www.naukri.com/network-administrator-jobs?xt=catsrch&qf[]=24.06,Network Administrator,Super India Tech Mark,0-2 Yrs,"1,25,000 - 2,25,000 PA.",Cuttack
Network administrator Jobs,https://www.naukri.com/network-administrator-jobs?xt=catsrch&qf[]=24.06,Network Administrator,Super India Tech Mark,0-2 Yrs,"1,25,000 - 2,25,000 PA.",Patna
Network administrator Jobs,https://www.naukri.com/network-administrator-jobs?xt=catsrch&qf[]=24.06,Network Administrator,Super India Tech Mark,0-1 Yrs,"2,00,000 - more than 3,00,000 PA.",Jabalpur
Network administrator Jobs,https://www.naukri.com/network-administrator-jobs?xt=catsrch&qf[]=24.06,Network Administrator,Super India Tech Mark,0-2 Yrs,"1,25,000 - 2,25,000 PA.",Gurgaon/Gurugram
Network administrator Jobs,https://www.naukri.com/network-administrator-jobs?xt=catsrch&qf[]=24.06,Network Administrator,Super India Tech Mark,0-2 Yrs,"1,25,000 - 2,25,000 PA.",Greater Noida(Sector Xu-III)
Network administrator Jobs,https://www.naukri.com/network-administrator-jobs?xt=catsrch&qf[]=24.06,Network Administrator,Super India Tech Mark,0-1 Yrs,"2,00,000 - more than 3,00,000 PA.",Ludhiana
Network administrator Jobs,https://www.naukri.com/network-administrator-jobs?xt=catsrch&qf[]=24.06,Network Administrator,Super India Tech Mark,0-1 Yrs,"2,00,000 - 3,25,000 PA.",Firozabad
Network administrator Jobs,https://www.naukri.com/network-administrator-jobs?xt=catsrch&qf[]=24.06,Network Administrator,Super India Tech Mark,0-2 Yrs,"1,25,000 - 2,25,000 PA.",Coimbatore
Network administrator Jobs,https://www.naukri.com/network-administrator-jobs?xt=catsrch&qf[]=24.06,Network Administrator,Super India Tech Mark,0-1 Yrs,"2,00,000 - 4,25,000 PA.",Latur
Network administrator Jobs,https://www.naukri.com/network-administrator-jobs?xt=catsrch&qf[]=24.06,Network Administrator,Super India Tech Mark,0-2 Yrs,"1,25,000 - 2,25,000 PA.",Kanpur
Network administrator Jobs,https://www.naukri.com/network-administrator-jobs?xt=catsrch&qf[]=24.06,Network Administrator,IBM India Pvt. Limited,8-12 Yrs,Not disclosed,Pune
Network administrator Jobs,https://www.naukri.com/network-administrator-jobs?xt=catsrch&qf[]=24.06,Network Admin,Amdocs Development Center India Pvt. Ltd.,3-5 Yrs,Not disclosed,Pune
Network administrator Jobs,https://www.naukri.com/network-administrator-jobs?xt=catsrch&qf[]=24.06,Network Administrator,einfochips Pvt Ltd,3-4 Yrs,Not disclosed,Ahmedabad
Network administrator Jobs,https://www.naukri.com/network-administrator-jobs?xt=catsrch&qf[]=24.06,System Admin & Network Engineer / Hardware - 2020 Passout Can also app,Creative Hands HR Consultancy,0-2 Yrs,"4,00,000 - 6,00,000 PA.","Mumbai, Indore, Hyderabad/Secunderabad, Pune, Chennai, Bangalore/Bengaluru"
Network administrator Jobs,https://www.naukri.com/network-administrator-jobs?xt=catsrch&qf[]=24.06,System and Network Administrator,Incentius,2-3 Yrs,Not disclosed,"Pune, Bangalore/Bengaluru, Mumbai (All Areas)"
Network administrator Jobs,https://www.naukri.com/network-administrator-jobs?xt=catsrch&qf[]=24.06,Network Administrator,RAJU TECH INDIA PRIVATE LIMITED,3-5 Yrs,"3,00,000 - 4,50,000 PA.",Hyderabad/Secunderabad
IT Jobs,https://www.naukri.com/information-technology-jobs?xt=catsrch&qf[]=24,INFORMATION TECHNOLOGY: ASSISTANT MANAGER,VIVO Healthcare,4-9 Yrs,Not disclosed,Gurgaon/Gurugram
IT Jobs,https://www.naukri.com/information-technology-jobs?xt=catsrch&qf[]=24,Senior Manager Information Technology,Senior Manager Information Technology,10-15 Yrs,Not disclosed,"Unnao, Kanpur"
IT Jobs,https://www.naukri.com/information-technology-jobs?xt=catsrch&qf[]=24,Information Technology,Stefanini,12-22 Yrs,Not disclosed,Noida
IT Jobs,https://www.naukri.com/information-technology-jobs?xt=catsrch&qf[]=24,Associate Director of Information Technology,ExecBoardinAsia,5-10 Yrs,Not disclosed,Bangalore/Bengaluru
IT Jobs,https://www.naukri.com/information-technology-jobs?xt=catsrch&qf[]=24,Director- School of Computing and Information Technology,Rukmini Educational Charitable Trust,20-25 Yrs,Not disclosed,Bangalore/Bengaluru
IT Jobs,https://www.naukri.com/information-technology-jobs?xt=catsrch&qf[]=24,Engineer Information Technology,Lear Corporation,3-6 Yrs,Not disclosed,Pune
IT Jobs,https://www.naukri.com/information-technology-jobs?xt=catsrch&qf[]=24,Manager Information Technology,Bhavna Corp.,8-10 Yrs,Not disclosed,Hyderabad/Secunderabad
