Legal Jobs,https://www.naukri.com/legal-jobs?xt=catsrch&qf[]=13,Internship Trainee - Legal. Location : Mumbai,Receivables Exchange of India Limited,0-1 Yrs,"50,000 - 1,00,000 PA.",Mumbai
Legal Jobs,https://www.naukri.com/legal-jobs?xt=catsrch&qf[]=13,Legal & Compliance Officer,CardinalHealth,0-0 Yrs,Not disclosed,"Bangalore/Bengaluru, Bangalore"
Legal Jobs,https://www.naukri.com/legal-jobs?xt=catsrch&qf[]=13,Manager/ Senior Manager Legal,Evalueserve.com Pvt. Ltd,8-12 Yrs,Not disclosed,Gurgaon/Gurugram
Legal Jobs,https://www.naukri.com/legal-jobs?xt=catsrch&qf[]=13,Legal Manager II Kolhapur,Aavas Financiers Limited,2-7 Yrs,"1,00,000 - more than 3,00,000 PA.",Kolhapur
Legal Jobs,https://www.naukri.com/legal-jobs?xt=catsrch&qf[]=13,Assistant Manager Legal,Nvent Thermal India Pvt Ltd,4-6 Yrs,"6,00,000 - 8,00,000 PA.",Mumbai (All Areas)
Legal Jobs,https://www.naukri.com/legal-jobs?xt=catsrch&qf[]=13,Executive Legal,Schneider Electric,2-7 Yrs,Not disclosed,Bangalore/Bengaluru
Legal Jobs,https://www.naukri.com/legal-jobs?xt=catsrch&qf[]=13,Legal Manager,Larsen & Toubro Limited,6-11 Yrs,"11,00,000 - 14,00,000 PA.","Chennai, Bangalore/Bengaluru"
Legal Jobs,https://www.naukri.com/legal-jobs?xt=catsrch&qf[]=13,Assistant Manager – Legal,BOB Financial Solutions Ltd,3-8 Yrs,Not disclosed,Mumbai (All Areas)
Legal Jobs,https://www.naukri.com/legal-jobs?xt=catsrch&qf[]=13,"Senior Manager, Legal",Invesco,8-10 Yrs,Not disclosed,Hyderabad/Secunderabad
Legal Jobs,https://www.naukri.com/legal-jobs?xt=catsrch&qf[]=13,Intern- Legal - Gurgaon,SS Supply Chain Solutions Pvt. Ltd. (3SC),0-3 Yrs,"2,00,000 - 2,50,000 PA.",Gurgaon/Gurugram
Legal Jobs,https://www.naukri.com/legal-jobs?xt=catsrch&qf[]=13,"Legal Manager II Hubli, Jaya Nagar, Yelahanka",Aavas Financiers Limited,2-7 Yrs,"2,00,000 - 4,00,000 PA.","Bhubaneswar, Hubli, Bangalore/Bengaluru"
Marketing Jobs,https://www.naukri.com/marketing-jobs?xt=catsrch&qf[]=15,Digital Marketing Executive,Team Management Services,0-3 Yrs,Not disclosed,Mumbai
Marketing Jobs,https://www.naukri.com/marketing-jobs?xt=catsrch&qf[]=15,Marketing Executive,Kraftplus Edutech Private Limited,0-1 Yrs,Not disclosed,Bangalore/Bengaluru
Marketing Jobs,https://www.naukri.com/marketing-jobs?xt=catsrch&qf[]=15,Openings For Marketing Executive Post in Goa - Fresher's Apply Now!!,ECHOBOOOM MANAGEMENT ENTREPRENEURIAL SOLUTIONS PRIVATE LIMITED,0-2 Yrs,"2,00,000 - 5,00,000 PA.","South Goa, Panaji/Panjim, Vasco Da Gama, North Goa"
Marketing Jobs,https://www.naukri.com/marketing-jobs?xt=catsrch&qf[]=15,Marketing Executive,WEIWO Communication Pvt. Ltd.,30 March - 02 April,Not disclosed,Bangalore/Bengaluru(Jayanagar +2)
Marketing Jobs,https://www.naukri.com/marketing-jobs?xt=catsrch&qf[]=15,Digital Analyst & Content Marketing- Asst. Manager,AdLift Marketing Pvt. Ltd.,0-3 Yrs,"3,00,000 - 5,00,000 PA.","New Delhi, Gurgaon/Gurugram"
Marketing Jobs,https://www.naukri.com/marketing-jobs?xt=catsrch&qf[]=15,Digital Marketing Executive,Valued Epistemics Pvt. Ltd.,0-2 Yrs,Not disclosed,Chennai
Marketing Jobs,https://www.naukri.com/marketing-jobs?xt=catsrch&qf[]=15,Digital Marketing Executive (Full Time),Purpple Enterprise,0-2 Yrs,"90,000 - 1,25,000 PA.",Kolkata(Chinar Park +5)
Marketing Jobs,https://www.naukri.com/marketing-jobs?xt=catsrch&qf[]=15,Social Media Marketing Executive | Location- Chembur,The Propertist,0-2 Yrs,"1,25,000 - 3,00,000 PA.",Mumbai
Marketing Jobs,https://www.naukri.com/marketing-jobs?xt=catsrch&qf[]=15,Marketing Executive,Raviva Infotech Pvt Ltd,0-2 Yrs,Not disclosed,Mumbai
Marketing Jobs,https://www.naukri.com/marketing-jobs?xt=catsrch&qf[]=15,Digital Marketing Manager,Super India Tech Mark,0-2 Yrs,"1,25,000 - 2,25,000 PA.",Saharanpur
Marketing Jobs,https://www.naukri.com/marketing-jobs?xt=catsrch&qf[]=15,Digital Marketing Manager,Super India Tech Mark,0-2 Yrs,"1,25,000 - 2,25,000 PA.",Pune(Shetphal Haveli)
Marketing Jobs,https://www.naukri.com/marketing-jobs?xt=catsrch&qf[]=15,Assistant Brand Manager / Digital marketing,Paras Healthcare,0-5 Yrs,Not disclosed,Udaipur
Marketing Jobs,https://www.naukri.com/marketing-jobs?xt=catsrch&qf[]=15,Digital Marketing - Intern,Nikulsan,0-1 Yrs,Not disclosed,Bangalore/Bengaluru
Marketing Jobs,https://www.naukri.com/marketing-jobs?xt=catsrch&qf[]=15,Digital Marketing Analyst/ Asst. Manager Content Marketing,AdLift Marketing (P) Ltd,0-3 Yrs,Not disclosed,Gurgaon/Gurugram
Marketing Jobs,https://www.naukri.com/marketing-jobs?xt=catsrch&qf[]=15,Marketing Manager - Vaccines,GlaxoSmithKline Pharmaceuticals Limited,10-12 Yrs,Not disclosed,Mumbai
Marketing Jobs,https://www.naukri.com/marketing-jobs?xt=catsrch&qf[]=15,Marketing Executive,Marriott,0-2 Yrs,Not disclosed,Chennai
Marketing Jobs,https://www.naukri.com/marketing-jobs?xt=catsrch&qf[]=15,Digital Marketing Executive,Cumulations Technologies Pvt. Ltd.,0-1 Yrs,Not disclosed,Bangalore/Bengaluru
Marketing Jobs,https://www.naukri.com/marketing-jobs?xt=catsrch&qf[]=15,Immediate opening For Digital marketing executive,Implexians Eco Solutions Pvt Ltd.,0-1 Yrs,"2,50,000 - 3,00,000 PA.",Bangalore/Bengaluru(Banashankari Stage II)
Marketing Jobs,https://www.naukri.com/marketing-jobs?xt=catsrch&qf[]=15,Digital Marketing Executive,PASKON (INDIA) PRIVATE LIMITED Limited,0-2 Yrs,Not disclosed,Bangalore/Bengaluru(Indira Nagar)
Packaging Jobs,https://www.naukri.com/packaging-jobs?xt=catsrch&qf[]=18,Packaging Development Executive,ITC Limited Foods Division,0-3 Yrs,"6,00,000 - 9,00,000 PA.",Bangalore/Bengaluru
Packaging Jobs,https://www.naukri.com/packaging-jobs?xt=catsrch&qf[]=18,Officer -Packaging Development Executive (FMCG),Amar Tea Private Limited,0-1 Yrs,"1,00,000 - 3,00,000 PA.",Mumbai(Parel)
Packaging Jobs,https://www.naukri.com/packaging-jobs?xt=catsrch&qf[]=18,Application Packaging Engineer,ITC Infotech India Ltd,3-7 Yrs,"8,00,000 - 11,00,000 PA.",Mumbai (All Areas)
Packaging Jobs,https://www.naukri.com/packaging-jobs?xt=catsrch&qf[]=18,Electrical Engineering For Flexible Packaging Factory at Kenya,United HR Solutions Pvt Ltd,8-13 Yrs,"8,00,000 - 10,00,000 PA.",Kenya Africa
Packaging Jobs,https://www.naukri.com/packaging-jobs?xt=catsrch&qf[]=18,Deputy Manager - Flexible Packaging Adhesive,Cosmo Films,6-10 Yrs,"15,00,000 - 18,00,000 PA.",Mumbai (All Areas)
Packaging Jobs,https://www.naukri.com/packaging-jobs?xt=catsrch&qf[]=18,Senior Advanced Packaging Engineer,Applied Materials,8-13 Yrs,"25,00,000 - 40,00,000 PA.",Bangalore/Bengaluru
Packaging Jobs,https://www.naukri.com/packaging-jobs?xt=catsrch&qf[]=18,Assistant Manager Package Design & Development,PFIZER LIMITED,5-8 Yrs,Not disclosed,Visakhapatnam
Packaging Jobs,https://www.naukri.com/packaging-jobs?xt=catsrch&qf[]=18,Manager - Packaging Development,The Himalayan Drug,8-10 Yrs,Not disclosed,Bangalore/Bengaluru
Packaging Jobs,https://www.naukri.com/packaging-jobs?xt=catsrch&qf[]=18,Opening For Packaging Maintenance Executive,ITC Ltd,5-7 Yrs,Not disclosed,Tiruchirapalli/Trichy
Packaging Jobs,https://www.naukri.com/packaging-jobs?xt=catsrch&qf[]=18,Package Consultant: SAP HANA FIN FI,IBM India Pvt. Limited,6-8 Yrs,Not disclosed,Kolkata
Packaging Jobs,https://www.naukri.com/packaging-jobs?xt=catsrch&qf[]=18,Package Consultant: SAP HANA SCM MM,IBM India Pvt. Limited,4-8 Yrs,Not disclosed,Bangalore/Bengaluru
Packaging Jobs,https://www.naukri.com/packaging-jobs?xt=catsrch&qf[]=18,Package Consultant: Workday Reporting & BI,IBM India Pvt. Limited,3-7 Yrs,Not disclosed,"Noida, Hyderabad/Secunderabad, Bangalore/Bengaluru"
Packaging Jobs,https://www.naukri.com/packaging-jobs?xt=catsrch&qf[]=18,Package Consultant: Oracle Business Analytics Cloud,IBM India Pvt. Limited,3-6 Yrs,Not disclosed,Bangalore/Bengaluru
Packaging Jobs,https://www.naukri.com/packaging-jobs?xt=catsrch&qf[]=18,Package Consultant: SAP Hana FIN FICA,IBM India Pvt. Limited,6-8 Yrs,Not disclosed,Bangalore/Bengaluru
Packaging Jobs,https://www.naukri.com/packaging-jobs?xt=catsrch&qf[]=18,Package Consultant: SAP HANA FIN FI,IBM India Pvt. Limited,6-8 Yrs,Not disclosed,Kolkata
Packaging Jobs,https://www.naukri.com/packaging-jobs?xt=catsrch&qf[]=18,Package Consultant SAP SRM,IBM India Pvt. Limited,6-10 Yrs,Not disclosed,Bangalore/Bengaluru
Packaging Jobs,https://www.naukri.com/packaging-jobs?xt=catsrch&qf[]=18,Package Consultant: SAP HANA FIN FI,IBM India Pvt. Limited,6-8 Yrs,Not disclosed,Bangalore/Bengaluru
Packaging Jobs,https://www.naukri.com/packaging-jobs?xt=catsrch&qf[]=18,Package Consultant: SAP HANA SCM SD,IBM India Pvt. Limited,6-8 Yrs,Not disclosed,Bangalore/Bengaluru
Packaging Jobs,https://www.naukri.com/packaging-jobs?xt=catsrch&qf[]=18,Package Consultant: SAP HANA FIN FI,IBM India Pvt. Limited,6-10 Yrs,Not disclosed,Bangalore/Bengaluru
Pharma Jobs,https://www.naukri.com/pharma-jobs?xt=catsrch&qf[]=16,"Fresher Medical Coding Jobs For Pharma,Pharmacist, Pharmacy,b pharm gr",Achievers Spot,0-3 Yrs,"3,25,000 - 4,50,000 PA.","Tiruchirapalli/Trichy, Chennai, Erode"
Pharma Jobs,https://www.naukri.com/pharma-jobs?xt=catsrch&qf[]=16,Production Department - Gland Pharma Limited @ Hyderabad,Gland Pharma Ltd.,0-4 Yrs,"1,50,000 - 3,00,000 PA.",Hyderabad/Secunderabad
Pharma Jobs,https://www.naukri.com/pharma-jobs?xt=catsrch&qf[]=16,"Medical Coding Job For Pharma,Pharmaceutical,Pharmacist, Pharmacy grad",Achievers Spot,0-3 Yrs,"3,25,000 - 4,50,000 PA.","Tiruchirapalli/Trichy, Chennai, Erode"
Pharma Jobs,https://www.naukri.com/pharma-jobs?xt=catsrch&qf[]=16,"Medical Coding Job For Pharma,Pharmaceutical,Pharmacist, Pharmacy,bpha",Achievers Spot,0-3 Yrs,"3,25,000 - 4,50,000 PA.","Tiruchirapalli/Trichy, Chennai, Erode"
Pharma Jobs,https://www.naukri.com/pharma-jobs?xt=catsrch&qf[]=16,"Medical Coding Job For Pharma,Pharmaceutical,Pharmacist,B Pharmacy gra",Achievers Spot,0-3 Yrs,"3,25,000 - 4,50,000 PA.","Chennai, Tiruchirapalli/Trichy, Erode"
Pharma Jobs,https://www.naukri.com/pharma-jobs?xt=catsrch&qf[]=16,Medical Representative - BSC / B Pharma Fresher Can Apply,AFFLUENTIAL PHARMACEUTICALS PVT LTD,0-2 Yrs,"1,50,000 - 3,00,000 PA.",Hyderabad/Secunderabad(Miyapur +6)
Pharma Jobs,https://www.naukri.com/pharma-jobs?xt=catsrch&qf[]=16,Manager Medical Affairs - Ahmedabad,Pharma Placements Inc.,2-7 Yrs,"15,00,000 - 20,00,000 PA.",Ahmedabad
Pharma Jobs,https://www.naukri.com/pharma-jobs?xt=catsrch&qf[]=16,Opportunity For Pharma and Life Science graduates.,Inventurus Knowledge Solutions Private Limited,0-3 Yrs,Not disclosed,"Mumbai, Thane, Navi Mumbai"
Pharma Jobs,https://www.naukri.com/pharma-jobs?xt=catsrch&qf[]=16,Sales Executive - Medical equipments/ Disposables Pharma / Orthopedic,Devon Innovations Pvt Ltd,3-5 Yrs,Not disclosed,Hyderabad/Secunderabad
Pharma Jobs,https://www.naukri.com/pharma-jobs?xt=catsrch&qf[]=16,"Job - F N D(M Pharma,freshers), Time office(graduates with good excel)",Makin Laboratories Private Limited,0-2 Yrs,Not disclosed,Indore
Pharma Jobs,https://www.naukri.com/pharma-jobs?xt=catsrch&qf[]=16,Medical Coder Job-Bpharm/mpharm/pharmacy/pharmacist/pharma Grad Wanted,AS Medical Coding Technologies,0-3 Yrs,"3,25,000 - 4,00,000 PA.","Madurai, Chennai, Coimbatore"
Pharma Jobs,https://www.naukri.com/pharma-jobs?xt=catsrch&qf[]=16,Medical Coder Job-Bpharm/mpharm/pharmacy/pharmacist/pharma Grad Wanted,AS Medical Coding Technologies,0-2 Yrs,"3,25,000 - 4,00,000 PA.","Madurai, Chennai, Coimbatore"
Pharma Jobs,https://www.naukri.com/pharma-jobs?xt=catsrch&qf[]=16,Medical Coder Job-B pharm/m pharm/d pharm/pharm d/pharma Grad Wanted,AS Medical Coding Technologies,0-3 Yrs,"3,25,000 - 4,00,000 PA.","Madurai, Chennai, Coimbatore"
Pharma Jobs,https://www.naukri.com/pharma-jobs?xt=catsrch&qf[]=16,Regional Medical Advisor-Mumbai (leading MNC Pharma Company),Vertex Corporate Services (I) Pvt Ltd,0-3 Yrs,Not disclosed,Mumbai
Pharma Jobs,https://www.naukri.com/pharma-jobs?xt=catsrch&qf[]=16,Regional Medical Advisor-Kolkatta (leading MNC Pharma Company),Vertex Corporate Services (I) Pvt Ltd,0-3 Yrs,Not disclosed,Kolkata
Pharma Jobs,https://www.naukri.com/pharma-jobs?xt=catsrch&qf[]=16,Regional Medical Advisor-Bangalore (leading MNC Pharma Company),Vertex Corporate Services (I) Pvt Ltd,0-3 Yrs,Not disclosed,Bangalore/Bengaluru
Pharma Jobs,https://www.naukri.com/pharma-jobs?xt=catsrch&qf[]=16,Regional Medical Advisor-Delhi NCR (leading MNC Pharma Company),Vertex Corporate Services (I) Pvt Ltd,0-3 Yrs,Not disclosed,Delhi / NCR
Pharma Jobs,https://www.naukri.com/pharma-jobs?xt=catsrch&qf[]=16,Aurobindo Pharma is Hiring For Technical Asst Process Development &TTD,aurobindo pharma ltd,5-8 Yrs,Not disclosed,"Jadcherla, Mahabubnagar/Mahaboobnagar"
Pharma Jobs,https://www.naukri.com/pharma-jobs?xt=catsrch&qf[]=16,Aurobindo Pharma is Hiring For Executive Process Development &TTD,aurobindo pharma ltd,5-8 Yrs,Not disclosed,"Jadcherla, Mahabubnagar/Mahaboobnagar"
Maintenance Jobs,https://www.naukri.com/maintenance-jobs?xt=catsrch&qf[]=19,Electrical Maintenance Engineer,Super India Tech Mark,0-1 Yrs,"1,75,000 - 3,25,000 PA.",Kota
Maintenance Jobs,https://www.naukri.com/maintenance-jobs?xt=catsrch&qf[]=19,Electrical Maintenance Engineer,Super India Tech Mark,0-1 Yrs,"1,75,000 - 3,00,000 PA.",Kakinada
Maintenance Jobs,https://www.naukri.com/maintenance-jobs?xt=catsrch&qf[]=19,Electrical Maintenance Engineer,Super India Tech Mark,0-1 Yrs,"1,75,000 - 2,75,000 PA.",Tumkur
Maintenance Jobs,https://www.naukri.com/maintenance-jobs?xt=catsrch&qf[]=19,Electrical Maintenance Engineer,Super India Tech Mark,0-1 Yrs,"2,00,000 - more than 3,00,000 PA.",Jalandhar
Maintenance Jobs,https://www.naukri.com/maintenance-jobs?xt=catsrch&qf[]=19,Urgently Looking For Operation and Maintenance Electrical Engineers,WIND WORLD (INDIA) LIMITED,0-4 Yrs,"1,75,000 - 2,50,000 PA.","Kutch/kachchh, Jamnagar, Porbandar"
Maintenance Jobs,https://www.naukri.com/maintenance-jobs?xt=catsrch&qf[]=19,Maintenance Engineer Electrical,PFIZER LIMITED,3-6 Yrs,Not disclosed,Visakhapatnam
Maintenance Jobs,https://www.naukri.com/maintenance-jobs?xt=catsrch&qf[]=19,Maintenance Engineer,Super India Tech Mark,0-2 Yrs,"1,25,000 - 2,25,000 PA.",Bellary/Ballari
Maintenance Jobs,https://www.naukri.com/maintenance-jobs?xt=catsrch&qf[]=19,Maintenance Engineer,Super India Tech Mark,0-2 Yrs,"1,25,000 - 2,25,000 PA.",Belagavi/Belgaum
Maintenance Jobs,https://www.naukri.com/maintenance-jobs?xt=catsrch&qf[]=19,Maintenance Engineer,Super India Tech Mark,0-1 Yrs,"2,00,000 - 3,75,000 PA.",Sambhal
Maintenance Jobs,https://www.naukri.com/maintenance-jobs?xt=catsrch&qf[]=19,Maintenance Engineer,Super India Tech Mark,0-1 Yrs,"1,75,000 - 3,25,000 PA.",Sonipat/Sonepat
Maintenance Jobs,https://www.naukri.com/maintenance-jobs?xt=catsrch&qf[]=19,Maintenance Engineer,Super India Tech Mark,0-2 Yrs,"1,25,000 - 2,25,000 PA.",Nagpur
Maintenance Jobs,https://www.naukri.com/maintenance-jobs?xt=catsrch&qf[]=19,Maintenance Engineer,Super India Tech Mark,0-2 Yrs,"1,50,000 - 2,50,000 PA.",Pune(Bhigwan)
Maintenance Jobs,https://www.naukri.com/maintenance-jobs?xt=catsrch&qf[]=19,Mechanical Maintenance Engineer,Super India Tech Mark,0-1 Yrs,"2,00,000 - 3,25,000 PA.",Roorkee
Maintenance Jobs,https://www.naukri.com/maintenance-jobs?xt=catsrch&qf[]=19,Maintenance Engineer,Super India Tech Mark,0-1 Yrs,"2,00,000 - more than 3,00,000 PA.",Bhilai/Bhillai
Maintenance Jobs,https://www.naukri.com/maintenance-jobs?xt=catsrch&qf[]=19,Maintenance Engineer,Super India Tech Mark,0-1 Yrs,"2,00,000 - 3,25,000 PA.",Ludhiana
Maintenance Jobs,https://www.naukri.com/maintenance-jobs?xt=catsrch&qf[]=19,Maintenance Engineer,Super India Tech Mark,0-2 Yrs,"1,25,000 - 2,25,000 PA.",Bangalore/Bengaluru(Irigenahalli)
Maintenance Jobs,https://www.naukri.com/maintenance-jobs?xt=catsrch&qf[]=19,Operation and Maintenance Team - Robotics Museum Freshers invited,Engineering Services International,0-2 Yrs,Not disclosed,Ahmedabad(Science City)
Maintenance Jobs,https://www.naukri.com/maintenance-jobs?xt=catsrch&qf[]=19,Freshers For Desktop Maintenance & Network Engineer,Adaequare Info Private Ltd.,0-1 Yrs,Not disclosed,Hyderabad/Secunderabad
Maintenance Jobs,https://www.naukri.com/maintenance-jobs?xt=catsrch&qf[]=19,Junior Engineer Maintenance (Electrical/Automation),Tetra Pak India Pvt. Ltd,2-7 Yrs,Not disclosed,Pune
Logistics Jobs,https://www.naukri.com/logistics-jobs?xt=catsrch&qf[]=14,Executive - Logistics,AAMRO FREIGHT & SHIPPING SERVICES LLC,0-3 Yrs,Not disclosed,Chennai
Logistics Jobs,https://www.naukri.com/logistics-jobs?xt=catsrch&qf[]=14,Logistics Manager,Super India Tech Mark,0-1 Yrs,"2,00,000 - more than 3,00,000 PA.",Mumbai (All Areas)
Logistics Jobs,https://www.naukri.com/logistics-jobs?xt=catsrch&qf[]=14,"Senior Transaction Manager Industrial, Logistics & Supply Chain",CBRE Group,6-10 Yrs,Not disclosed,Mumbai
Logistics Jobs,https://www.naukri.com/logistics-jobs?xt=catsrch&qf[]=14,Logistics Executive,Super India Tech Mark,0-1 Yrs,"1,50,000 - 2,50,000 PA.",Patna
Logistics Jobs,https://www.naukri.com/logistics-jobs?xt=catsrch&qf[]=14,Logistics Manager,Super India Tech Mark,0-1 Yrs,"2,00,000 - 3,75,000 PA.",Thane
Logistics Jobs,https://www.naukri.com/logistics-jobs?xt=catsrch&qf[]=14,Logistics Manager,Super India Tech Mark,0-1 Yrs,"2,00,000 - 3,00,000 PA.",Amritsar
Logistics Jobs,https://www.naukri.com/logistics-jobs?xt=catsrch&qf[]=14,Graduate / Shipping & Logistics Executive - Freshers - 2020 Passout,Creative Hands HR Consultancy,0-4 Yrs,"3,00,000 - 6,00,000 PA.","Mumbai, Indore, Hyderabad/Secunderabad, Pune, Chennai, Bangalore/Bengaluru"
Logistics Jobs,https://www.naukri.com/logistics-jobs?xt=catsrch&qf[]=14,Graduate / Shipping & Logistics Executive - Freshers - 2020 Passout,Creative Hands HR Consultancy,0-4 Yrs,"3,00,000 - 6,00,000 PA.","Mumbai, Hyderabad/Secunderabad, Pune, Chennai, Jaipur, Bangalore/Bengaluru"
Logistics Jobs,https://www.naukri.com/logistics-jobs?xt=catsrch&qf[]=14,Senior Logistics Manager,NIYA LOGISTICS & AVIATION SKILL DEVELOPMENT TECHNOLOGY PRIVATE LIMITED,10-15 Yrs,"5,00,000 - 10,00,000 PA.","Chennai, Bangalore/Bengaluru"
Logistics Jobs,https://www.naukri.com/logistics-jobs?xt=catsrch&qf[]=14,Team Leader Logistics - Entire Tamilnadu,Flipkart Internet Private Limited,0-2 Yrs,"50,000 - 3,00,000 PA.",Krishnagiri
Logistics Jobs,https://www.naukri.com/logistics-jobs?xt=catsrch&qf[]=14,"Logistics Executive, Logistics Manager",Magadh Logistics Private Limited,2-4 Yrs,"2,00,000 - 2,75,000 PA.","Kolkata(Sonarpur), Siliguri, Patna"
Logistics Jobs,https://www.naukri.com/logistics-jobs?xt=catsrch&qf[]=14,Logistics Executive (SCM),Novel Office,0-2 Yrs,Not disclosed,Bangalore/Bengaluru(HSR Layout +2)
Logistics Jobs,https://www.naukri.com/logistics-jobs?xt=catsrch&qf[]=14,Graduate / Shipping & Logistics Executive - Freshers - 2020 Passout,Creative Hands HR Consultancy,0-4 Yrs,"3,00,000 - 6,00,000 PA.","Hyderabad/Secunderabad, Pune, Ahmedabad, Chennai, Bangalore/Bengaluru, Delhi / NCR"
Logistics Jobs,https://www.naukri.com/logistics-jobs?xt=catsrch&qf[]=14,Warehouse & Logistics Executive,NAVITUS LOGISTICS PRIVATE LIMITED,0-5 Yrs,"2,50,000 - 7,50,000 PA.",Mumbai
Logistics Jobs,https://www.naukri.com/logistics-jobs?xt=catsrch&qf[]=14,Sales Manager - Logistics / Supply Chain Business,Elixia Tech Solutions Limited,2-6 Yrs,"5,00,000 - 12,00,000 PA.",Mumbai(Vidya Vihar West)
Logistics Jobs,https://www.naukri.com/logistics-jobs?xt=catsrch&qf[]=14,Logistics Executive,Novel Office,0-3 Yrs,Not disclosed,Bangalore/Bengaluru(HSR Layout +5)
Logistics Jobs,https://www.naukri.com/logistics-jobs?xt=catsrch&qf[]=14,operation logistics,Super India Tech Mark,0-1 Yrs,"1,75,000 - 2,50,000 PA.",Bhubaneswar
Logistics Jobs,https://www.naukri.com/logistics-jobs?xt=catsrch&qf[]=14,Associate Logistics Analyst,ecolab,0-3 Yrs,Not disclosed,Pune
Logistics Jobs,https://www.naukri.com/logistics-jobs?xt=catsrch&qf[]=14,Branch Head : Ahmedabad – Gujarat| Transportation & Logistics,MRC LOGISTICS INDIA PRIVATE LIMITED,10-20 Yrs,"5,00,000 - 7,00,000 PA.",Ahmedabad
Sales Jobs,https://www.naukri.com/sales-jobs?xt=catsrch&qf[]=22,US Mortgage Telemarketing Sales Executive – Work from Home - D,Commercial Capital Funding Group,3-8 Yrs,"3,50,000 - 6,50,000 PA.","Chandigarh, Delhi / NCR, Mumbai (All Areas)"
Sales Jobs,https://www.naukri.com/sales-jobs?xt=catsrch&qf[]=22,Sales Executive,KING WIN POLYMERS,3-7 Yrs,Not disclosed,"Kolhapur, Pune, Aurangabad"
Sales Jobs,https://www.naukri.com/sales-jobs?xt=catsrch&qf[]=22,Home Sales Officer,Reliance Industries Ltd,0-4 Yrs,"50,000 - 2,25,000 PA.",Kolkata(Sealdah +2)
Sales Jobs,https://www.naukri.com/sales-jobs?xt=catsrch&qf[]=22,Area Sales Manager,SAJ Food Products (P) Ltd(Bisk Farm),4-9 Yrs,Not disclosed,"Kolkata(Ariadaha +4), Siliguri, Nasik/Nashik, Rourkela, Burdwan/Barddhaman, Berhampur, Asansol, Birbhum, Berhampore"
Sales Jobs,https://www.naukri.com/sales-jobs?xt=catsrch&qf[]=22,Sales Executive,Lifecell International Private Ltd(Asia Cryo-Cell),0-5 Yrs,"50,000 - 3,00,000 PA.","Mumbai Suburban, Pune"
Sales Jobs,https://www.naukri.com/sales-jobs?xt=catsrch&qf[]=22,Axis Bank Hiring Sales Executive @ Kolkata,Axis Bank Limited,0-5 Yrs,"1,25,000 - 2,00,000 PA.",Kolkata
Sales Jobs,https://www.naukri.com/sales-jobs?xt=catsrch&qf[]=22,Hiring For Business Development Executive/Manager - Inside Sales,Bhash Software Labs,0-4 Yrs,"1,75,000 - 2,75,000 PA.",Bangalore/Bengaluru(HSR Layout)
Sales Jobs,https://www.naukri.com/sales-jobs?xt=catsrch&qf[]=22,Business Development Executive- Garment Sales,Greenfield Resources Pvt Ltd,0-5 Yrs,Not disclosed,Ahmedabad
Sales Jobs,https://www.naukri.com/sales-jobs?xt=catsrch&qf[]=22,Area Sales Executive / Sales Executive,Riser Enterprise,0-5 Yrs,Not disclosed,"Pimpri-Chinchwad, Pune"
Sales Jobs,https://www.naukri.com/sales-jobs?xt=catsrch&qf[]=22,Area Sales Manager,Super India Tech Mark,0-1 Yrs,"2,00,000 - more than 3,00,000 PA.",Guwahati
Sales Jobs,https://www.naukri.com/sales-jobs?xt=catsrch&qf[]=22,SAAS Business Development Executive | SAAS Sales Job Mumbai,Advids.co,0-3 Yrs,"2,50,000 - 4,00,000 PA.","Kolkata, Hyderabad/Secunderabad, Mumbai (All Areas)"
Sales Jobs,https://www.naukri.com/sales-jobs?xt=catsrch&qf[]=22,International Business Development Executive | Inside Sales Job Mumbai,Advids.co,0-3 Yrs,"2,50,000 - 4,00,000 PA.","Mumbai, Thane, Nasik/Nashik"
Sales Jobs,https://www.naukri.com/sales-jobs?xt=catsrch&qf[]=22,IT Sales Executive | Fresher Online Sales Job | MBA Freshers Mumbai,Advids.co,0-3 Yrs,"2,50,000 - 4,00,000 PA.","Mumbai, Thane, Nasik/Nashik"
Sales Jobs,https://www.naukri.com/sales-jobs?xt=catsrch&qf[]=22,Inside Sales Executive | Fresher Online Sales Job Mumbai,Advids.co,0-3 Yrs,"2,50,000 - 4,00,000 PA.","Mumbai, Thane, Nasik/Nashik"
Sales Jobs,https://www.naukri.com/sales-jobs?xt=catsrch&qf[]=22,Hiring Freshers as Inside Sales Executive| OmnePresent technologies,Omnepresent Technologies Private Limited,0-1 Yrs,Not disclosed,"Mumbai, Pune"
Sales Jobs,https://www.naukri.com/sales-jobs?xt=catsrch&qf[]=22,"Digital Marketing, Sales Executive, Business development executive",WTM IT LIMITED,0-5 Yrs,Not disclosed,"Thane, Navi Mumbai, Mumbai (All Areas)"
Sales Jobs,https://www.naukri.com/sales-jobs?xt=catsrch&qf[]=22,"Corporate Sales Manager - Bangalore, Pune & Mumbai",City Info Services Pvt. Ltd.,0-5 Yrs,Not disclosed,"Mumbai, Pune, Bangalore/Bengaluru"
Sales Jobs,https://www.naukri.com/sales-jobs?xt=catsrch&qf[]=22,Unit Manager B2B Sales ( Mutual Funds & Insurance)- Mulund & Vashi,NJ India Invest Pvt Ltd,0-3 Yrs,"50,000 - 3,00,000 PA.","Navi Mumbai, Mumbai (All Areas)(Mulund)"
Sales Jobs,https://www.naukri.com/sales-jobs?xt=catsrch&qf[]=22,"Sales Executives For GT Outlets, Snack Foods, Mumbai, Freshers Welcome",MedicoTrans Pvt. Ltd.,0-1 Yrs,"1,75,000 - 4,00,000 PA.",Mumbai(Colaba +6)
Sales Jobs,https://www.naukri.com/sales-jobs?xt=catsrch&qf[]=22,Sales Executive _ Automobile Industry at Kolkata,INTEGRATED PERSONNEL SERVICES LIMITED,1-6 Yrs,"70,000 - 2,25,000 PA.","Kolkata(Tollygunge +7), Dalhousie"
Sales Jobs,https://www.naukri.com/sales-jobs?xt=catsrch&qf[]=22,Sales Executive _ Automobile Industry at Kolkata,INTEGRATED PERSONNEL SERVICES LIMITED,1-6 Yrs,"70,000 - 2,25,000 PA.","Kolkata(Tollygunge +7), Dalhousie"
Secretary Jobs,https://www.naukri.com/secretary-jobs?xt=catsrch&qf[]=11,Personal Secretary/ Executive Assistant To the CEO (Female),FACTOR STREET ECOMMERCE SERVICES PVT LTD,0-2 Yrs,"2,00,000 - 5,50,000 PA.","Bangalore/Bengaluru, Delhi / NCR, Mumbai (All Areas)"
Secretary Jobs,https://www.naukri.com/secretary-jobs?xt=catsrch&qf[]=11,Executive Assistant / Personal Secretary,Group of Institutions (4 Post Graduate/Graduate Colleges and 4 Schools),0-5 Yrs,"1,50,000 - 3,00,000 PA.",Bangalore/Bengaluru(Bannerghatta Road)
Secretary Jobs,https://www.naukri.com/secretary-jobs?xt=catsrch&qf[]=11,Executive Company Secretary,Inditex,1-2 Yrs,Not disclosed,Gurgaon/Gurugram
Secretary Jobs,https://www.naukri.com/secretary-jobs?xt=catsrch&qf[]=11,Administration Executive cum Personal Secretary,D.K.CHHAJER & CO.,0-3 Yrs,Not disclosed,Kolkata
Secretary Jobs,https://www.naukri.com/secretary-jobs?xt=catsrch&qf[]=11,Company Secretary Cum Executive Assistant,M G Bakers Pvt.Ltd.,2-4 Yrs,"6,00,000 - 8,00,000 PA.",Mohali/SAS Nagar
Secretary Jobs,https://www.naukri.com/secretary-jobs?xt=catsrch&qf[]=11,Executive Assistant ( Secretary) Female only,SS Consultancy,2-7 Yrs,Not disclosed,Mumbai
Secretary Jobs,https://www.naukri.com/secretary-jobs?xt=catsrch&qf[]=11,Qualified Company Secretary (CS),Dhiraj Shubham & CO LLP,29 March - 07 April,"3,50,000 - 4,75,000 PA.",Chennai
Secretary Jobs,https://www.naukri.com/secretary-jobs?xt=catsrch&qf[]=11,Company Secretary with CA(inter)- 6month To 1yr-Exp,Enterprise Software Solutions Lab Private Limited,0-1 Yrs,"3,00,000 - 4,00,000 PA.",Bangalore/Bengaluru(2nd Phase JP Nagar +2)
