Accounting Jobs,https://www.naukri.com/accounting-jobs?xt=catsrch&qf[]=1,"CA Inter, CA, MCOM, accountant cum internal auditor For Kenya Nairobi",KALP SHAH GST CLASSES,0-5 Yrs,"8,50,000 - 12,00,000 PA.",Kenya
Accounting Jobs,https://www.naukri.com/accounting-jobs?xt=catsrch&qf[]=1,Senior associate - GL,NEXDIGM PRIVATE LIMITED,2-4 Yrs,Not disclosed,Pune
Accounting Jobs,https://www.naukri.com/accounting-jobs?xt=catsrch&qf[]=1,Immediate Joiners_ Accounts/ Fee Executive@ Vibgyor School Haralur,Rustomjee Kerawala Foundation,0-2 Yrs,"1,00,000 - 3,00,000 PA.",Bangalore/Bengaluru(Haralur Road)
Accounting Jobs,https://www.naukri.com/accounting-jobs?xt=catsrch&qf[]=1,Chartered Accountants,Larsen & Toubro Limited,0-2 Yrs,Not disclosed,"Chennai, Mumbai (All Areas)"
Accounting Jobs,https://www.naukri.com/accounting-jobs?xt=catsrch&qf[]=1,Accounts Receivable/Payable Executive - With Good Communication Skill,Southern Cross Group India Pvt Ltd,0-2 Yrs,Not disclosed,Chennai
Accounting Jobs,https://www.naukri.com/accounting-jobs?xt=catsrch&qf[]=1,Sr. Executive/Asst. Manager - Finance & Accounts,Dr Lal PathLabs,0-3 Yrs,"5,50,000 - 6,50,000 PA.",Gurgaon/Gurugram
Accounting Jobs,https://www.naukri.com/accounting-jobs?xt=catsrch&qf[]=1,Female - Key Account Executive in Amin Hospital Ahmedabad,Lifecell International Private Ltd(Asia Cryo-Cell),0-4 Yrs,"1,00,000 - 2,75,000 PA.",Ahmedabad
Accounting Jobs,https://www.naukri.com/accounting-jobs?xt=catsrch&qf[]=1,Walk-In -Accounts Process Executive For Tally (Hindi & English),Greet Technologies Pvt Ltd.,25 March - 03 April,"1,75,000 - 2,00,000 PA.",Bangalore/Bengaluru(HSR Layout)
Accounting Jobs,https://www.naukri.com/accounting-jobs?xt=catsrch&qf[]=1,Accounts Executive,Super India Tech Mark,0-2 Yrs,"1,50,000 - 2,50,000 PA.",Chennai(Soundara Pandianar Nagar)
Accounting Jobs,https://www.naukri.com/accounting-jobs?xt=catsrch&qf[]=1,Accounts Executive,CARAVEL LOGISTICS PVT. LTD.,01 April - 05 April,Not disclosed,Chennai(Egmore)
Accounting Jobs,https://www.naukri.com/accounting-jobs?xt=catsrch&qf[]=1,"Accounts & Finance Executive, Freshers",Creative Hands HR Consultancy,0-5 Yrs,"4,00,000 - 6,00,000 PA.","Mumbai, Indore, Hyderabad/Secunderabad, Pune, Chennai, Bangalore/Bengaluru"
Accounting Jobs,https://www.naukri.com/accounting-jobs?xt=catsrch&qf[]=1,Accounts Payable Executive,Super India Tech Mark,0-2 Yrs,"1,25,000 - 2,25,000 PA.",Gopalpur
Accounting Jobs,https://www.naukri.com/accounting-jobs?xt=catsrch&qf[]=1,Executive - Accounts,Gokaldas Exports Ltd,0-0 Yrs,Not disclosed,Bangalore/Bengaluru
Accounting Jobs,https://www.naukri.com/accounting-jobs?xt=catsrch&qf[]=1,Accounts Executive,Super India Tech Mark,0-1 Yrs,"2,00,000 - 3,25,000 PA.",Bangalore/Bengaluru
Accounting Jobs,https://www.naukri.com/accounting-jobs?xt=catsrch&qf[]=1,Accounts Executive,KGISL BSS- Division of KG Information System Priva te Limited,0-4 Yrs,Not disclosed,"Coimbatore, Bangalore/Bengaluru"
Accounting Jobs,https://www.naukri.com/accounting-jobs?xt=catsrch&qf[]=1,Accounts Process Executive,advantiqs,0-2 Yrs,Not disclosed,Bangalore/Bengaluru
Accounting Jobs,https://www.naukri.com/accounting-jobs?xt=catsrch&qf[]=1,Accounts Executive,Super India Tech Mark,0-2 Yrs,"1,25,000 - 2,25,000 PA.",Hyderabad/Secunderabad(Errakunta)
Accounting Jobs,https://www.naukri.com/accounting-jobs?xt=catsrch&qf[]=1,Accounts & Audit Executive,Virinchi Hospital,0-2 Yrs,"1,75,000 - 2,50,000 PA.",Hyderabad/Secunderabad
Accounting Jobs,https://www.naukri.com/accounting-jobs?xt=catsrch&qf[]=1,Inside Sales Account Manager,Simplilearn,0-4 Yrs,"4,50,000 - 7,50,000 PA.",Bangalore/Bengaluru(HSR Layout)
Accounting Jobs,https://www.naukri.com/accounting-jobs?xt=catsrch&qf[]=1,Accounts Freshers,Trigent Software,0-1 Yrs,"50,000 - 1,50,000 PA.",Bangalore/Bengaluru
Accounting Jobs,https://www.naukri.com/accounting-jobs?xt=catsrch&qf[]=1,Accounts Freshers,Trigent Software,0-1 Yrs,"50,000 - 1,50,000 PA.",Bangalore/Bengaluru
Interior Design Jobs,https://www.naukri.com/interior-design-jobs?xt=catsrch&qf[]=2,Senior Interior Designer (Designs Mentor),select home interior designers private limited,4-6 Yrs,"6,00,000 - 8,00,000 PA.",Bangalore/Bengaluru(HSR Layout)
Interior Design Jobs,https://www.naukri.com/interior-design-jobs?xt=catsrch&qf[]=2,Interior Designer (2D),J M LIFESTYLE INTERIOR PROJECTS PRIVATE LIMITED,0-3 Yrs,"2,50,000 - 3,00,000 PA.","Kochi/Cochin, Chennai, Bangalore/Bengaluru"
Interior Design Jobs,https://www.naukri.com/interior-design-jobs?xt=catsrch&qf[]=2,Interior Designer-Commercial -office spaces,Symmetrics Development Services Pvt Ltd,0-2 Yrs,"2,50,000 - more than 3,00,000 PA.",Bangalore/Bengaluru
Interior Design Jobs,https://www.naukri.com/interior-design-jobs?xt=catsrch&qf[]=2,Interior Designer,Adhvithi Builders and Interiors Private Limited,0-5 Yrs,"1,75,000 - 6,75,000 PA.",Bangalore/Bengaluru(Hebbal)
Interior Design Jobs,https://www.naukri.com/interior-design-jobs?xt=catsrch&qf[]=2,Interior Designer,Super India Tech Mark,0-2 Yrs,"1,25,000 - 2,25,000 PA.",Jalgaon
Interior Design Jobs,https://www.naukri.com/interior-design-jobs?xt=catsrch&qf[]=2,Interior Designer,Super India Tech Mark,0-1 Yrs,"2,25,000 - 4,25,000 PA.",Kalyan/Dombivli
Interior Design Jobs,https://www.naukri.com/interior-design-jobs?xt=catsrch&qf[]=2,Architect Interior Designer,Xena Design,0-5 Yrs,"1,50,000 - 4,00,000 PA.","Thane, Kalyan/Dombivli, Mumbai (All Areas)"
Interior Design Jobs,https://www.naukri.com/interior-design-jobs?xt=catsrch&qf[]=2,Interior Designer,kk consulting services,0-5 Yrs,Not disclosed,Mumbai
Interior Design Jobs,https://www.naukri.com/interior-design-jobs?xt=catsrch&qf[]=2,Interior Designer,Super India Tech Mark,0-2 Yrs,"1,50,000 - 2,50,000 PA.",Mumbai (All Areas)(Joveli Gaon)
Interior Design Jobs,https://www.naukri.com/interior-design-jobs?xt=catsrch&qf[]=2,Interior Designer,Super India Tech Mark,0-1 Yrs,"2,00,000 - 3,75,000 PA.",Amritsar
Interior Design Jobs,https://www.naukri.com/interior-design-jobs?xt=catsrch&qf[]=2,Interior Designer,Super India Tech Mark,0-2 Yrs,"1,25,000 - 2,25,000 PA.",Jalandhar
Interior Design Jobs,https://www.naukri.com/interior-design-jobs?xt=catsrch&qf[]=2,Interior Designers,Scheme Interiors,0-5 Yrs,Not disclosed,Thane
Interior Design Jobs,https://www.naukri.com/interior-design-jobs?xt=catsrch&qf[]=2,Interior Designer,Super India Tech Mark,0-2 Yrs,"1,25,000 - 2,25,000 PA.",Guwahati
Interior Design Jobs,https://www.naukri.com/interior-design-jobs?xt=catsrch&qf[]=2,Architect Interior Designer,Super India Tech Mark,0-2 Yrs,"1,25,000 - 2,25,000 PA.",Guntur
Interior Design Jobs,https://www.naukri.com/interior-design-jobs?xt=catsrch&qf[]=2,Interior Designer,Super India Tech Mark,0-2 Yrs,"1,00,000 - 2,00,000 PA.",Hyderabad/Secunderabad(Pasumamula)
Interior Design Jobs,https://www.naukri.com/interior-design-jobs?xt=catsrch&qf[]=2,Interior Designer,Super India Tech Mark,0-1 Yrs,"1,75,000 - 2,25,000 PA.",Pondicherry/Puducherry
Interior Design Jobs,https://www.naukri.com/interior-design-jobs?xt=catsrch&qf[]=2,Interior Designer,Super India Tech Mark,0-2 Yrs,"1,25,000 - 2,25,000 PA.",Hyderabad/Secunderabad(Errakunta)
Interior Design Jobs,https://www.naukri.com/interior-design-jobs?xt=catsrch&qf[]=2,Interior Designer,Super India Tech Mark,0-1 Yrs,"1,75,000 - 2,75,000 PA.",Chandigarh
Interior Design Jobs,https://www.naukri.com/interior-design-jobs?xt=catsrch&qf[]=2,Architect Interior Designer,Super India Tech Mark,0-2 Yrs,"1,25,000 - 2,25,000 PA.",Hugli
Bank Jobs,https://www.naukri.com/bank-jobs?xt=catsrch&qf[]=6,Axis Bank Hiring Sales Executive @ Kolkata,Axis Bank Limited,0-5 Yrs,"1,25,000 - 2,00,000 PA.",Kolkata
Bank Jobs,https://www.naukri.com/bank-jobs?xt=catsrch&qf[]=6,Indusind Bank - Senior Relationship Manager - NR - For Mumbai location,INDUSIND BANK LIMITED,4-8 Yrs,"10,00,000 - 16,00,000 PA.","Mumbai, Navi Mumbai"
Bank Jobs,https://www.naukri.com/bank-jobs?xt=catsrch&qf[]=6,Banking Back Office Executive,THE JOB HR AGENCY,0-1 Yrs,"50,000 - 1,00,000 PA.",Kolkata(Dhapa +75)
Bank Jobs,https://www.naukri.com/bank-jobs?xt=catsrch&qf[]=6,Axis Bank Hiring Sales Executive @ Bhubaneswar,Axis Bank Limited,0-5 Yrs,"1,25,000 - 2,00,000 PA.","Bhubaneswar, Cuttack, Sambalpur"
Bank Jobs,https://www.naukri.com/bank-jobs?xt=catsrch&qf[]=6,Job Opening– Axis Bank –Loan Products -Agri products,Axis Bank Limited,0-5 Yrs,Not disclosed,"East Godavari, Kadapa/Cuddapah, Visakhapatnam, West Godavari, Guntur, Kurnool, Chittoor, Nellore, Andhrapradesh Other"
Bank Jobs,https://www.naukri.com/bank-jobs?xt=catsrch&qf[]=6,Branch Acquisition Manager - Credit Card with Indusind Bank Ahmedabad,INDUSIND BANK LIMITED,0-3 Yrs,Not disclosed,Ahmedabad
Bank Jobs,https://www.naukri.com/bank-jobs?xt=catsrch&qf[]=6,"Virtual Relationship Manager(outbound sales) with Axis Bank, Mumbai",Axis Bank Limited,1-6 Yrs,"3,00,000 - 6,50,000 PA.","Noida, Mumbai (All Areas)"
Bank Jobs,https://www.naukri.com/bank-jobs?xt=catsrch&qf[]=6,Fresher Banking Jobs IN Kolkata,THE JOB HR AGENCY,0-0 Yrs,"1,25,000 - 2,50,000 PA.",Kolkata(Clive House +67)
Bank Jobs,https://www.naukri.com/bank-jobs?xt=catsrch&qf[]=6,Sales Officer | Merchant Acquisition - QR Scan Code | AU Bank,AU SMALL FINANCE BANK Limited,0-5 Yrs,"50,000 - 2,25,000 PA.","Udaipur, Surat, Ahmednagar, Delhi / NCR"
Bank Jobs,https://www.naukri.com/bank-jobs?xt=catsrch&qf[]=6,Business Banking Relationship Manager- Gurgaon and Sonipat,HDFC Bank Limited,5-10 Yrs,Not disclosed,"Sonipat/Sonepat, Gurgaon/Gurugram"
Bank Jobs,https://www.naukri.com/bank-jobs?xt=catsrch&qf[]=6,Business Banking/Working Capital Relationship Manager-UP&Uttarakhand,HDFC Bank Limited,4-9 Yrs,"4,00,000 - 8,00,000 PA.","Ghaziabad, Kanpur, Lucknow"
Bank Jobs,https://www.naukri.com/bank-jobs?xt=catsrch&qf[]=6,Urgent Job Opening at Axis Bank (for Male) -Under Quess Payroll,Axis Bank Limited,0-5 Yrs,"1,00,000 - 4,00,000 PA.","Neyveli, Chidambaram, Nagapattinam, Tiruvannamalai, Panruti, Cuddalore, Virudhachalam, Villupuram/Viluppuram, Sirkali"
Bank Jobs,https://www.naukri.com/bank-jobs?xt=catsrch&qf[]=6,Urgent Job Opening at Axis Bank (for Male) -Under Quess Payroll,Axis Bank Limited,0-3 Yrs,"1,50,000 - 4,00,000 PA.","Chengalpattu, Tambaram, Chennai"
Bank Jobs,https://www.naukri.com/bank-jobs?xt=catsrch&qf[]=6,Openings For Sales officer @ Axis Bank (vendor payroll)_ Shakarnagar,Axis Bank Limited,0-5 Yrs,"2,50,000 - 2,75,000 PA.",Bangalore/Bengaluru(Jalahalli +4)
Bank Jobs,https://www.naukri.com/bank-jobs?xt=catsrch&qf[]=6,Sales Officer @Axis Bank on partner's role (Quess Corp),Axis Bank Limited,0-4 Yrs,"90,000 - 1,50,000 PA.","Bhopal, Gwalior, Sagar"
Bank Jobs,https://www.naukri.com/bank-jobs?xt=catsrch&qf[]=6,LOAN OFFICER_AXIS Bank (Partner PAY Rolls),Axis Bank Limited,0-5 Yrs,"50,000 - 1,50,000 PA.","Mohali, Chandigarh"
Bank Jobs,https://www.naukri.com/bank-jobs?xt=catsrch&qf[]=6,Hiring For Relationship manager - Employee Banking- SCB,Standard Chartered Bank,3-7 Yrs,Not disclosed,"Hyderabad/Secunderabad, Chennai, Bangalore/Bengaluru, Delhi / NCR, Mumbai (All Areas)"
Bank Jobs,https://www.naukri.com/bank-jobs?xt=catsrch&qf[]=6,Urgent Opening For Sr Relationship Managers and RM's - Indusind Bank,INDUSIND BANK LIMITED,4-9 Yrs,"6,00,000 - 10,00,000 PA.",Delhi / NCR
Bank Jobs,https://www.naukri.com/bank-jobs?xt=catsrch&qf[]=6,Axis Bank : CBG :Sales Manager : Uttar Pradesh,Axis Bank Limited,4-8 Yrs,"5,00,000 - 10,00,000 PA.","Varanasi/Benaras, Lucknow, Uttar Pradesh"
Content Writing Jobs,https://www.naukri.com/content-writing-jobs?xt=catsrch&qf[]=5,Psychology - Academic Content Writer || Work from Home,Evelyn learning Systems Pvt ltd,0-2 Yrs,"1,75,000 - 2,50,000 PA.","Kolkata, Mumbai, Hyderabad/Secunderabad, Pune, Ahmedabad, Chennai, Bangalore/Bengaluru, Delhi / NCR, Mumbai (All Areas)"
Content Writing Jobs,https://www.naukri.com/content-writing-jobs?xt=catsrch&qf[]=5,Academic Content Writer || Mathematics || Day Shift || Work From Home,Evelyn learning Systems Pvt ltd,0-3 Yrs,"2,00,000 - 3,00,000 PA.","Kota, Kolkata, Mumbai, Pune, Chennai, Ahmedabad, Bangalore/Bengaluru, Delhi / NCR"
Content Writing Jobs,https://www.naukri.com/content-writing-jobs?xt=catsrch&qf[]=5,Academic Content Writer || Physics || Work from Home,Evelyn learning Systems Pvt ltd,0-3 Yrs,"1,25,000 - 3,00,000 PA.","Kolkata, Mumbai, Hyderabad/Secunderabad, Ahmedabad, Chennai, Gurgaon/Gurugram, Bangalore/Bengaluru, Delhi / NCR"
Content Writing Jobs,https://www.naukri.com/content-writing-jobs?xt=catsrch&qf[]=5,Proposal Content Writers Work From Home Urgent Hiring,Solvoguru,0-3 Yrs,"2,00,000 - 4,00,000 PA.","Hissar/Hisar, Delhi / NCR, Mumbai (All Areas)"
Content Writing Jobs,https://www.naukri.com/content-writing-jobs?xt=catsrch&qf[]=5,Blog Writer / Content Writer,LiveSalesman India,0-5 Yrs,"2,00,000 - 4,00,000 PA.","Noida, New Delhi, Delhi / NCR"
Content Writing Jobs,https://www.naukri.com/content-writing-jobs?xt=catsrch&qf[]=5,Content Developer / Web Content Writer - Full Time Job | Urgent,DAS WRITING SERVICES PRIVATE LIMITED,0-2 Yrs,"1,00,000 - 2,50,000 PA.",Kolkata
Content Writing Jobs,https://www.naukri.com/content-writing-jobs?xt=catsrch&qf[]=5,Hiring For - Research Content Writer - Immediate Joiners,Trupp Global Technologies Pvt Ltd,0-4 Yrs,"2,00,000 - 4,50,000 PA.",Bangalore/Bengaluru(Kasturi Nagar)
Content Writing Jobs,https://www.naukri.com/content-writing-jobs?xt=catsrch&qf[]=5,Academic Content Writer/Subject Matter Expert(0-2 Yrs),Sams Solutions Training Centre,0-2 Yrs,"2,00,000 - 2,50,000 PA.",Kolkata(Park Street +2)
Content Writing Jobs,https://www.naukri.com/content-writing-jobs?xt=catsrch&qf[]=5,Freelance Content Writer (part/full Time) Work @ Home 55,Weaving Thoughts,0-5 Yrs,"50,000 - 1,00,000 PA.","Noida, Kolkata, New Delhi, Hyderabad/Secunderabad, Pune, Chennai, Gurgaon/Gurugram, Delhi / NCR, Bangalore/Bengaluru"
Content Writing Jobs,https://www.naukri.com/content-writing-jobs?xt=catsrch&qf[]=5,Intern - Content Writing,Revolux Solutions Pvt. Ltd.,0-1 Yrs,Not disclosed,Anywhere in India
Content Writing Jobs,https://www.naukri.com/content-writing-jobs?xt=catsrch&qf[]=5,Content writer – Pai International Electronics Lt Bangalore,PAI International Electronics Limited,0-5 Yrs,Not disclosed,Bangalore/Bengaluru
Content Writing Jobs,https://www.naukri.com/content-writing-jobs?xt=catsrch&qf[]=5,Content Writing Intern,Zeta Inc.,0-1 Yrs,Not disclosed,Bangalore/Bengaluru
Content Writing Jobs,https://www.naukri.com/content-writing-jobs?xt=catsrch&qf[]=5,Content Writer,Analytics Insight,0-2 Yrs,Not disclosed,Hyderabad/Secunderabad(KPHB)
Content Writing Jobs,https://www.naukri.com/content-writing-jobs?xt=catsrch&qf[]=5,English Content Writer Internship | Content Writer Intern paid,AKASH DAYAL GROUPS,0-0 Yrs,Not disclosed,New Delhi
Content Writing Jobs,https://www.naukri.com/content-writing-jobs?xt=catsrch&qf[]=5,Freelance Content Writer,GODOT ENTERTAINMENT AND MEDIA PRIVATE LIMITED,0-5 Yrs,"1,00,000 - 6,00,000 PA.","Mumbai, Bangalore/Bengaluru, Delhi / NCR"
Content Writing Jobs,https://www.naukri.com/content-writing-jobs?xt=catsrch&qf[]=5,Hiring For Content Writer - Pristyn Care,Pristyn Care,0-3 Yrs,"1,00,000 - 4,00,000 PA.","New Delhi, Faridabad, Gurgaon/Gurugram"
Content Writing Jobs,https://www.naukri.com/content-writing-jobs?xt=catsrch&qf[]=5,Content Writer - Trainee (Work-from-office),Dream Care Furnishings Pvt. Ltd.,0-2 Yrs,Not disclosed,Delhi / NCR(Patparganj Industrial Area)
Content Writing Jobs,https://www.naukri.com/content-writing-jobs?xt=catsrch&qf[]=5,Hiring For Digital Marketing & Content Writing Intern( Female ),SGS Services,0-0 Yrs,Not disclosed,"Noida, New Delhi, Lucknow"
Content Writing Jobs,https://www.naukri.com/content-writing-jobs?xt=catsrch&qf[]=5,Content Writer | Creative Writing Job | Script Writing Job,Advids.co,0-2 Yrs,"2,00,000 - more than 3,00,000 PA.","Mysore/Mysuru, Pondicherry/Puducherry, Bangalore/Bengaluru"
Consultant Jobs,https://www.naukri.com/consultant-jobs?xt=catsrch&qf[]=9,Legal Consultant - Offrole position,Jones Lang LaSalle Property Consultants (India) Pv t. Ltd.,0-3 Yrs,Not disclosed,Bangalore/Bengaluru
Consultant Jobs,https://www.naukri.com/consultant-jobs?xt=catsrch&qf[]=9,SR/Attending/Associate Consultant -Liver GI - Critical Care,medanta,0-5 Yrs,Not disclosed,Gurgaon/Gurugram
Consultant Jobs,https://www.naukri.com/consultant-jobs?xt=catsrch&qf[]=9,Opening For Freshers - Associate Consultant Product Support,Greytip Software Pvt Ltd,0-1 Yrs,"50,000 - 2,50,000 PA.",Bangalore/Bengaluru(6th block Koramangala)
Consultant Jobs,https://www.naukri.com/consultant-jobs?xt=catsrch&qf[]=9,Consultant,Protiviti,0-3 Yrs,Not disclosed,"Mumbai, Gurgaon/Gurugram"
Consultant Jobs,https://www.naukri.com/consultant-jobs?xt=catsrch&qf[]=9,"Associate Consultant, SE",Apttus,0-2 Yrs,Not disclosed,Ahmedabad
Consultant Jobs,https://www.naukri.com/consultant-jobs?xt=catsrch&qf[]=9,Senior Solution Consultant -procurement / Merchandise Distribution / A,Walmart Global Tech India,0-5 Yrs,Not disclosed,Other
Consultant Jobs,https://www.naukri.com/consultant-jobs?xt=catsrch&qf[]=9,Senior Resident/ Attending Consultant - Obs. & Gynecology,MAX HEALTHCARE INSTITUTE Ltd,0-4 Yrs,Not disclosed,New Delhi
Consultant Jobs,https://www.naukri.com/consultant-jobs?xt=catsrch&qf[]=9,Senior Consultant,Super India Tech Mark,0-1 Yrs,"1,75,000 - 3,00,000 PA.",Agra
Consultant Jobs,https://www.naukri.com/consultant-jobs?xt=catsrch&qf[]=9,Senior Resident/Attending Consultant – Critical Care.,MAX HEALTHCARE INSTITUTE Ltd,0-5 Yrs,Not disclosed,Delhi / NCR
Consultant Jobs,https://www.naukri.com/consultant-jobs?xt=catsrch&qf[]=9,ITES Recruitment || Consultant/sr.consultant,Mancer Consulting Services Pvt. Ltd.,0-2 Yrs,Not disclosed,Delhi / NCR
Consultant Jobs,https://www.naukri.com/consultant-jobs?xt=catsrch&qf[]=9,Junior To Sr. Sales Consultant | Direct Walk-Ins | PolicyX.com,PolicyX.com,0-5 Yrs,"1,75,000 - 2,25,000 PA.",Indore
Consultant Jobs,https://www.naukri.com/consultant-jobs?xt=catsrch&qf[]=9,SR/Attending Consultant - Preventive Health and Wellness,medanta,0-5 Yrs,Not disclosed,Gurgaon/Gurugram
Consultant Jobs,https://www.naukri.com/consultant-jobs?xt=catsrch&qf[]=9,Senior Resident/ Attending Consultant - Cardiology @ Medanta,medanta,0-5 Yrs,Not disclosed,Gurgaon/Gurugram
Consultant Jobs,https://www.naukri.com/consultant-jobs?xt=catsrch&qf[]=9,Tech Mahindra Hiring - Recruitment Consultant - Contract,Tech Mahindra Limited,0-3 Yrs,"1,00,000 - 1,50,000 PA.",Chennai
Consultant Jobs,https://www.naukri.com/consultant-jobs?xt=catsrch&qf[]=9,Senior Resident / Attending Consultant - Radiation Oncology,medanta,0-3 Yrs,"11,00,000 - 14,00,000 PA.",Gurgaon/Gurugram
Consultant Jobs,https://www.naukri.com/consultant-jobs?xt=catsrch&qf[]=9,Associate Sales Consultant - Malayalam,LogicPlanet IT Services (India) Pvt. Ltd.,0-4 Yrs,Not disclosed,Mumbai (All Areas)
Consultant Jobs,https://www.naukri.com/consultant-jobs?xt=catsrch&qf[]=9,Associate Sales Consultant - Kannada,LogicPlanet IT Services (India) Pvt. Ltd.,0-4 Yrs,Not disclosed,Mumbai (All Areas)
Consultant Jobs,https://www.naukri.com/consultant-jobs?xt=catsrch&qf[]=9,Associate Sales Consultant - Tamil,LogicPlanet IT Services (India) Pvt. Ltd.,0-4 Yrs,Not disclosed,Mumbai (All Areas)
Consultant Jobs,https://www.naukri.com/consultant-jobs?xt=catsrch&qf[]=9,Associate Sales Consultant - Telugu,LogicPlanet IT Services (India) Pvt. Ltd.,0-4 Yrs,Not disclosed,Mumbai (All Areas)
Engineering Jobs,https://www.naukri.com/engineering-jobs?xt=catsrch&qf[]=21,Software Quality Engineer - Freshers,Virtual Engineering Services (P) LTD,0-1 Yrs,"1,50,000 - 3,00,000 PA.",Delhi / NCR
Engineering Jobs,https://www.naukri.com/engineering-jobs?xt=catsrch&qf[]=21,Software Engineer opportunity For Freshers at Conduent,CONDUENT BUSINESS SERVICES INDIA LLP,0-1 Yrs,Not disclosed,"Noida, New Delhi, Gurgaon/Gurugram"
Engineering Jobs,https://www.naukri.com/engineering-jobs?xt=catsrch&qf[]=21,Software Engineer (Fresher),ALPHASERVE TECHNOLOGIES IND PVT LTD,0-1 Yrs,Not disclosed,Bangalore/Bengaluru(Electronics City Phase 1)
Engineering Jobs,https://www.naukri.com/engineering-jobs?xt=catsrch&qf[]=21,Software Engineer Job For MCA Fresher Stipend/ Salary (3 – 5) Lakhs,techidobjects,0-1 Yrs,"3,00,000 - 5,00,000 PA.","Gurgaon/Gurugram, Jaipur, Bangalore/Bengaluru"
Engineering Jobs,https://www.naukri.com/engineering-jobs?xt=catsrch&qf[]=21,Software Engineer (Fresh Engineer),"Parallel Wireless, Inc.",0-2 Yrs,Not disclosed,Bangalore/Bengaluru
Engineering Jobs,https://www.naukri.com/engineering-jobs?xt=catsrch&qf[]=21,Software Engineer (Freshers / Entry Level only),Exim Softwares,0-1 Yrs,"2,50,000 - more than 3,00,000 PA.",Pune
Engineering Jobs,https://www.naukri.com/engineering-jobs?xt=catsrch&qf[]=21,Automation Test Engineer,HCL Technologies Ltd,0-2 Yrs,"50,000 - 3,00,000 PA.","Chennai, Bangalore/Bengaluru"
Engineering Jobs,https://www.naukri.com/engineering-jobs?xt=catsrch&qf[]=21,Yield Engineer,GLOBALFOUNDRIES Engineering Private Limited,0-3 Yrs,Not disclosed,Bangalore/Bengaluru
Engineering Jobs,https://www.naukri.com/engineering-jobs?xt=catsrch&qf[]=21,Software Quality Engineer,Altair Engineering,3-5 Yrs,Not disclosed,Bangalore/Bengaluru
Engineering Jobs,https://www.naukri.com/engineering-jobs?xt=catsrch&qf[]=21,Senior Engineer Integration & Yield,GLOBALFOUNDRIES Engineering Private Limited,0-5 Yrs,Not disclosed,Bangalore/Bengaluru
Engineering Jobs,https://www.naukri.com/engineering-jobs?xt=catsrch&qf[]=21,MTS Design Engineer (Embedded Memory),GLOBALFOUNDRIES Engineering Private Limited,0-2 Yrs,Not disclosed,Bangalore/Bengaluru
Engineering Jobs,https://www.naukri.com/engineering-jobs?xt=catsrch&qf[]=21,Principle Engineer - SRAM Development,GLOBALFOUNDRIES Engineering Private Limited,0-2 Yrs,Not disclosed,Bangalore/Bengaluru
Engineering Jobs,https://www.naukri.com/engineering-jobs?xt=catsrch&qf[]=21,Yield Engineer focused on Production Electrical Test Characterization,GLOBALFOUNDRIES Engineering Private Limited,0-3 Yrs,Not disclosed,Bangalore/Bengaluru
Engineering Jobs,https://www.naukri.com/engineering-jobs?xt=catsrch&qf[]=21,Semiconductor Defect Engineer,GLOBALFOUNDRIES Engineering Private Limited,0-3 Yrs,Not disclosed,Bangalore/Bengaluru
Engineering Jobs,https://www.naukri.com/engineering-jobs?xt=catsrch&qf[]=21,Software Engineer Java JavaScript Python,Altair Engineering,2-6 Yrs,Not disclosed,Bangalore/Bengaluru
Engineering Jobs,https://www.naukri.com/engineering-jobs?xt=catsrch&qf[]=21,Software / Application Support Engineer - Trainee - Freshers,Softeon India Pvt.Ltd,0-0 Yrs,Not disclosed,Chennai
Engineering Jobs,https://www.naukri.com/engineering-jobs?xt=catsrch&qf[]=21,Operation and Maintenance Team - Robotics Museum Freshers invited,Engineering Services International,0-2 Yrs,Not disclosed,Ahmedabad(Science City)
Engineering Jobs,https://www.naukri.com/engineering-jobs?xt=catsrch&qf[]=21,Software Engineer - Development III,ASM Technologies,5-10 Yrs,"1,50,000 - 6,50,000 PA.","Hyderabad/Secunderabad, Pune, Chennai, Coimbatore, Bangalore/Bengaluru"
Engineering Jobs,https://www.naukri.com/engineering-jobs?xt=catsrch&qf[]=21,Associate Software Engineer - Full Stack Developer,Boeing,0-3 Yrs,Not disclosed,Bangalore/Bengaluru
Export Import Jobs,https://www.naukri.com/export-import-jobs?xt=catsrch&qf[]=10,Executive Export & Import,Tekno Valves,0-5 Yrs,Not disclosed,Kolkata
Export Import Jobs,https://www.naukri.com/export-import-jobs?xt=catsrch&qf[]=10,Fresher job Opportunity To Learn Export Import - 2020 Passout Can also,Creative Hands HR Consultancy,0-4 Yrs,"3,75,000 - 6,00,000 PA.","Mumbai, Indore, Hyderabad/Secunderabad, Pune, Chennai, Bangalore/Bengaluru"
Export Import Jobs,https://www.naukri.com/export-import-jobs?xt=catsrch&qf[]=10,Export & Import Manager,Transasia Bio-Medicals Ltd.,8-10 Yrs,Not disclosed,Mumbai (All Areas)(Powai)
Export Import Jobs,https://www.naukri.com/export-import-jobs?xt=catsrch&qf[]=10,International Trade Executive For a leading Export/Import Agency,Myfuture,0-2 Yrs,"2,75,000 - 3,25,000 PA.","Noida, Ghaziabad, Faridabad, Gurgaon/Gurugram, Greater Noida, Delhi / NCR"
Export Import Jobs,https://www.naukri.com/export-import-jobs?xt=catsrch&qf[]=10,Senior Export Import Executive,AVI Global Plast Pvt. Ltd.,4-5 Yrs,"4,00,000 - 4,75,000 PA.",Mumbai(Marol)
Export Import Jobs,https://www.naukri.com/export-import-jobs?xt=catsrch&qf[]=10,Executive Export & Import,TRINITY PHARMACEUTICALS & FOOD PVT LTD,2-3 Yrs,"2,50,000 - more than 3,00,000 PA.",Mumbai (All Areas)
Export Import Jobs,https://www.naukri.com/export-import-jobs?xt=catsrch&qf[]=10,Export Import Executive,Ahuja Radios,7-12 Yrs,"4,50,000 - 6,00,000 PA.",New Delhi
Export Import Jobs,https://www.naukri.com/export-import-jobs?xt=catsrch&qf[]=10,Assistant Manager- Export & Import,Om Trans Logistics,2-7 Yrs,Not disclosed,Ahmedabad(Ashram Road)
Export Import Jobs,https://www.naukri.com/export-import-jobs?xt=catsrch&qf[]=10,Export - Import Documentation - Officer,Lincoln Pharmaceuticals Ltd.,1-3 Yrs,"1,75,000 - 2,50,000 PA.",Ahmedabad(Science City)
Export Import Jobs,https://www.naukri.com/export-import-jobs?xt=catsrch&qf[]=10,Executive Export & Import,RENATA PRECISION COMPONENTS PVT. LTD.,0-2 Yrs,"2,50,000 - 4,00,000 PA.",Pune(Sector No-7 Bhosari)
Export Import Jobs,https://www.naukri.com/export-import-jobs?xt=catsrch&qf[]=10,Export Import Logistics Manager,Fidelity IT,7-12 Yrs,Not disclosed,Andheri
Export Import Jobs,https://www.naukri.com/export-import-jobs?xt=catsrch&qf[]=10,Executive Export & Import,Sintex Industries Limited Yarn Division,0-2 Yrs,Not disclosed,Ahmedabad(Ghatlodia)
Export Import Jobs,https://www.naukri.com/export-import-jobs?xt=catsrch&qf[]=10,Import Export Executive,mycityrajkot,5-10 Yrs,Not disclosed,Rajkot
